name,price,grasa,calorias,kJ,sal,carbohidratos,proteinas
Bombón helado de galleta caramelizada con chocolate blanco Lotus Biscoff 3 ud.,"3,99 €",29.0 g,436.0 Kcal,1818.0 KJ,0.41 g,41.0 g,3.3 g
Pizza 4 quesos fina y crujiente Forno di Pietra Buitoni 340 g.,"3,65 €",10.8 g,247 Kcal,1034 KJ,1.00 g,24.6 g,11.8 g
Harina de trigo Carrefour 2 kg.,"1,39 €",2.6 g,352 Kcal,1490 KJ,0.02 g,71 g,9.9 g
Crepes de trigo relleno de quesos Carrefour 300 g.,"1,95 €",7.2 g,164 Kcal,688 KJ,0.85 g,20 g,4.8 g
Chocolate blanco de coco y almendra Raffaello Ferrero 90 g.,"2,59 €",41.7 g,595 Kcal,2474 KJ,0.269 g,46.5 g,7.5 g
Sal marina fina ecológica Ecocesta 1 kg.,"1,77 €",0 g,0 Kcal,0 KJ,39 g,0 g,0 g
Paella mixta 350 g,"2,85 €",3.9 g,149 Kcal,629 KJ,1.3 g,24 g,4.1 g
Queso de cabra Carrefour sin lactosa 280 g,"6,69 €",33 g,385 Kcal,1597 KJ,1.41 g,2.1 g,20 g
Bífidus desnatado con frutos rojos Danone Activia sin gluten y sin azúcar añadido pack de 4 unidades de 120 g.,"2,99 €",0.1 g,48 Kcal,206 KJ,0.13 g,6.2 g,4.8 g
Lomo extra de salmón noruego sin espinas congelado Royal 500 g,"19,89 €",11 g,181 Kcal,756 KJ,0.1 g,0.5 g,20 g
Salchichas de pavo Wieners Oscar Mayer sin gluten y sin lactosa pack de 3 unidades de 200 g.,"3,69 €",18 g,211 Kcal,873 KJ,2 g,1.2 g,11 g
Salchichón extra sin gluten 4x60 g,"2,09 €",44.6 g,491 Kcal,491 KJ,4.7 g,5.16 g,17.4 g
Hamburguesa mini de picaña Angus de vacuno Carrefour Selección Lord Dani 360 g,"5,29 €",12 g,190 Kcal,791 KJ,1.4 g,0 g,20 g
Mayonesa ligera Ybarra sin gluten y sin lactosa envase 400 g.,"2,05 €",25.0 g,267.0 Kcal,1102.0 KJ,2.0 g,9.0 g,1.0 g
Crema de espárragos Gallina Blanca 57 g.,"1,63 €",1.3 g,41 Kcal,170 KJ,0.63 g,6.5 g,0.6 g
Aceite de oliva virgen extra ecológico Carrefour Bio Hojiblanca 500 ml.,"6,25 €",99 g,900 Kcal,3700 KJ,0 g,0 g,0 g
Yogur líquido natural Carrefour Carrefour 1 kg.,"1,45 €",1.1 g,38 Kcal,160 KJ,0.13 g,4.1 g,2.9 g
"Filetón de bacalao salado Carrefour el Mercado 1,4 kg aprox","7,20 €",1 g,97 Kcal,411 KJ,22 g,0 g,22 g
"Tortitas de arroz integrales con chocolate negro Gullón Vitalday sin gluten 105,2 g.","1,76 €",18 g,456 Kcal,1913 KJ,0.5 g,64 g,7.0 g
Néctar de naranja Carrefour brik 1 l.,"0,86 €",0 g,30 Kcal,127 KJ,,7.2 g,
Galleta cookie chocolate blanco Nocilla 120 g.,"2,29 €",22 g,490 Kcal,2053 KJ,0.42 g,66 g,5.5 g
Chocolate con leche y almendras Nestlé Extrafino sin gluten 270 g.,"3,85 €",34.0 g,553 Kcal,2307 KJ,0.11 g,51.6 g,8.4 g
Mini huevos de chocolate con leche Classic Carrefour doy pack 200 g.,"2,99 €",40 g,590 Kcal,2456 KJ,,50 g,7 g
Mermelada de arándano ecológica Pedro Luís 300 g.,"4,39 €",0 g,169 Kcal,706 KJ,0 g,40 g,2 g
Chocolate negro con naranja confitada Carrefour Extra 200 g.,"1,66 €",27.0 g,508.0 Kcal,2119.0 KJ,0.06 g,55.0 g,6.3 g
Mini barrita de chocolate con corazón de leche Carrefour Classic' 200 g.,"1,94 €",33.0 g,543.0 Kcal,2268.0 KJ,0.23 g,54.0 g,8.1 g
Queso de oveja añejo De Nuestra Tierra cuña 200 g,"5,05 €",41 g,483 Kcal,2002 KJ,2 g,1.5 g,27 g
Queso brie punta President 200 g,"3,65 €",31 g,347 Kcal,1436 KJ,1.2 g,0.5 g,17 g
Néctar de piña Carrefour brik 1 l.,"0,91 €",0 g,32 Kcal,134 KJ,,7.7 g,
Patatas fritas corte fino especial horno Carrefour Classic' 600 g.,"1,26 €",5.4 g,161 Kcal,675 KJ,0.25 g,24 g,2.7 g
Pizza de bacon Carrefour 315 g.,"2,06 €",11 g,242 Kcal,1015 KJ,1.2 g,24 g,10 g
Guindillas en vinagre Rioverde 120 g.,"1,63 €",0 g,41 Kcal,173 KJ,2 g,7 g,3 g
Jamón de Cebo de Campo Ibérico 50% Raza Ibérica IberSierra pieza de 7 kg aprox,"179,00 €",31.3 g,415.0 Kcal,1724.0 KJ,3.6 g,0.1 g,33.3 g
Leche condensada entera Classic Carrefour 1 kg.,"4,49 €",8 g,322 Kcal,1357 KJ,0.2 g,55 g,7.5 g
Paleta curada D.O.P Teruel De Nuestra Tierra 100 g,"2,49 €",19.3 g,297 Kcal,1239 KJ,4.6 g,0 g,30.9 g
Salchichas viena Campofrío sin gluten sin lactosa pack de 3 unidades de 170 g.,"2,75 €",19 g,238 Kcal,973 KJ,2 g,2.9 g,13 g
Lenteja cocida categoría extra Luengo 400 g.,"1,34 €",0 g,87 Kcal,369 KJ,0.69 g,13 g,6.6 g
Bebida isotónica sabor limón 226ERS sin gluten y sin lactosa 1 kg.,"26,30 €",0 g,353 Kcal,1500 KJ,1.2 g,85 g,0 g
Pimientos del Piquillo enteros extra Carrefour 150 g.,"1,71 €",0 g,30 Kcal,129 KJ,0.5 g,5.4 g,1.5 g
Papilla infantil desde 4 meses crema de arroz Hero Baby sin gluten y sin azúcar añadido 220 g.,"2,95 €",1.0 g,384 Kcal,1630 KJ,0.03 g,85 g,8 g
Queso de vaca tierno 200 g.,"1,82 €",32 g,376 Kcal,1558 KJ,1.3 g,1 g,21 g
Caramelos sabor menta Smint pack de 2 paquetes de 50 ud.,"3,99 €",0.3 g,239 Kcal,995 KJ,0 g,98 g,0 g
Palitos de chocolate con leche Mikado Lu 75 g.,"1,99 €",19 g,476 Kcal,1999 KJ,0.84 g,68 g,7 g
Caramelos de goma Selection Mix Fini sin gluten 150 g.,"2,15 €",0 g,344 Kcal,1440.26 KJ,0.1 g,80 g,6 g
Almendras sin sal añadida Frumesa 200 g.,"3,69 €",60 g,661 Kcal,2730 KJ,0.03 g,4.4 g,21 g
Cereales solubles natural ecológico Eko Nestlé sin azúcar añadido 150 g.,"3,99 €",0.2 g,359 Kcal,1523 KJ,0.18 g,78.6 g,6.9 g
Tónica Carrefour pack de 6 botellas de 20 cl.,"2,09 €",0.0 g,34.0 Kcal,145.0 KJ,0.0 g,9.0 g,0.0 g
Helado Toblerone 480 ml.,"5,65 €",13 g,261 Kcal,1091 KJ,0.10 g,30 g,4.0 g
Patatas fritas sabor tomate y orégano light Frit Ravich 115 g.,"1,93 €",17 g,441 Kcal,1851 KJ,3.1 g,66 g,4.2 g
Guisantes finos al vapor Findus 400 g.,"3,49 €",0.5 g,89.0 Kcal,374.0 KJ,0.3 g,13.6 g,5.2 g
Fuet Imperial clásico El Pozo 250 g,"2,95 €",29 g,387.5 Kcal,1608 KJ,4 g,5 g,26.5 g
Cuatro Rayas Blanco 2022,"7,75 €",0.1 g,79.0 Kcal,327.0 KJ,0.009 g,1.6 g,0.1 g
Atún claro en aceite de girasol Calvo pack de 6 latas de 52 g.,"6,75 €",23 g,286 Kcal,1185 KJ,1 g,0 g,20 g
Galleta digestive Simply 400 g.,"0,85 €",19 g,466 Kcal,1953 KJ,1.7 g,64 g,7 g
Preparado lácteo infantil de crecimiento con cereales y cacao de 12 a 36 meses Puleva Peques 3 pack de 3 unidades de 200 ml.,"1,95 €",3.5 g,90 Kcal,377 KJ,0.11 g,12 g,2.4 g
Bacón cocido ahumado en tiras El Pozo Corte Fresco sin gluten y sin lactosa pack 4x60 g,"3,15 €",23 g,269 Kcal,1115.5 KJ,1.8 g,1.6 g,14 g
Pizza Spinaci Ristorante Dr. Oetker 390 g,"3,89 €",11 g,215 Kcal,901 KJ,0.98 g,21 g,7.2 g
Cacahuetes fritos sin sal añadida Carrefour 200 g.,"1,13 €",43 g,577 Kcal,2393 KJ,0.01 g,17 g,27 g
Salchichas cocidas estilo Viena Wieners con queso Oscar Mayer sin gluten 200 g.,"1,46 €",19 g,233 Kcal,967 KJ,2 g,1.5 g,14 g
Vino blanco joven ecológico El Hayedo D.O. Ribera del Guadiana Vendimia Seleccionada 75 cl.,"2,25 €",0.50 g,80 Kcal,334 KJ,0.010 g,0.50 g,1 g
Aceitunas verdes rellenas de anchoa La Española 130 g.,"2,65 €",12.8 g,132 Kcal,543 KJ,2.8 g,0.8 g,1.6 g
Baileys Deliciously Light Cremas,"16,25 €",5 g,188 Kcal,785 KJ,0.1 g,13 g,1 g
Queso ibérico viejo Extra Carrefour cuña cortada 250 g.,"4,59 €",38 g,452 Kcal,1874 KJ,2 g,0 g,27 g
Chipirón en trozos congelado Classic´ Carrefour 450 g.,"6,79 €",1.5 g,65 Kcal,275 KJ,1.1 g,0.6 g,12 g
Espárrago blanco extra grueso De Nuestra Tierra 220 g.,"9,75 €",0.5 g,18 Kcal,76 KJ,1 g,1.8 g,1.3 g
Cereales de avena tostada con chocolate Extra Kellogg's 500 g.,"5,25 €",25.0 g,497.0 Kcal,2078.0 KJ,0.63 g,57.0 g,8.0 g
Magdalenas redondas Simpl 360 g.,"1,25 €",24 g,449 Kcal,1878 KJ,0.65 g,52 g,5.3 g
Tónica Fever-Tree Mediterranean botella 20 cl.,"1,73 €",0.0 g,34.0 Kcal,144.0 KJ,0.02 g,7.9 g,0.0 g
Cocktail de frutos secos San Blas sin gluten 2 kg.,"7,79 €",26.3 g,490 Kcal,2047 KJ,1 g,41 g,19.1 g
Pipas El Piponazo Grefusa 240 g.,"3,09 €",21.0 g,258.0 Kcal,1068.0 KJ,10.0 g,1.8 g,14.0 g
Aceite de oliva virgen extra De Nuestra Tierra 1 l.,"12,89 €",100 g,899 Kcal,3697 KJ,0 g,0 g,0 g
Gaseosa Postobon sabor manzana botella 2 l.,"3,25 €",0 g,29 Kcal,123 KJ,0.008 g,8 g,0 g
Postre lácteo natural desde 6 meses Nestlé Yogolino sin gluten y sin azúcar añadido 100 g.,"1,46 €",3.0 g,71 Kcal,297 KJ,0.09 g,7.7 g,3.0 g
Cereales con frutas desecadas Muesli Carrefour 750 g.,"3,55 €",17.0 g,453.0 Kcal,1903.0 KJ,0.43 g,65.0 g,8.0 g
Langostino vannamei cocido 30/40 piezas Carrefour 400 g.,"4,59 €",1.4 g,93 Kcal,389 KJ,1.8 g,0 g,20.1 g
Classic Bebida Energética lata 25 cl.,"0,40 €",,31 Kcal,134 KJ,0.01 g,7.4 g,
Chocolate con leche original Ferrero Rocher 90 g.,"2,65 €",43.1 g,601 Kcal,2499 KJ,0.147 g,45.7 g,6.2 g
"Crema bombón 0,7% materia grasa Clesa sin gluten pack de 4 unidades de 125 g.","1,73 €",0.7 g,69 Kcal,293 KJ,0.2 g,11.8 g,3.6 g
Salchichas Jumbo de pollo Oscar Mayer sin gluten sin lactosa 350 g.,"2,65 €",18 g,218 Kcal,906 KJ,2.0 g,1.1 g,13 g
Pan hamburguesa Schär sin gluten y sin lactosa 300 g.,"4,35 €",2.4 g,226 Kcal,957 KJ,0.98 g,45 g,3.2 g
Kéfir natural Carrefour Sensation 500 g.,"1,30 €",4 g,66 Kcal,274 KJ,0 g,4 g,4 g
Harina de maíz Carrefour sin gluten 500 g.,"1,92 €",2.2 g,347 Kcal,1467 KJ,0.05 g,73 g,4.7 g
Queso havarti en lonchas Simpl 300 g.,"2,79 €",26 g,331 Kcal,1373 KJ,1.9 g,0.5 g,23 g
Mortadela Carrefour El Mercado sin gluten pieza de 800 g,"3,15 €",19 g,235 Kcal,975 KJ,2.1 g,5 g,11 g
Papilla infantil desde 6 meses 8 cereales Gerber sin azúcar añadido 475 g.,"6,99 €",4.6 g,399.0 Kcal,1687.0 KJ,0.10 g,76.4 g,10.0 g
Café soluble cappuccino descafeinado Nescafé Gold 250 g.,"4,55 €",6.9 g,379.0 Kcal,1601.0 KJ,0.9 g,66.9 g,8.7 g
Mantequilla pastilla sin sal Carrefour 250 g.,"1,99 €",83 g,754 Kcal,3100 KJ,0.05 g,1.1 g,0.6 g
Bizcocho brownie Milka 150 g.,"2,89 €",27 g,468 Kcal,1954 KJ,0.38 g,50 g,5 g
Tortitas de maíz Pop Corn Bicentury 70 g.,"1,73 €",17 g,476 Kcal,2000 KJ,1.9 g,73 g,7 g
Rejo cocido trozeado 250 g,"4,95 €",0.8 g,67 Kcal,283 KJ,1.4 g,0.01 g,15 g
Copos suaves de avena integral ecológico EcoCesta sin gluten 500 g.,"3,25 €",6.90 g,365 Kcal,1530 KJ,0.00 g,56.00 g,14.00 g
Cacao soluble puro sin azúcares añadidos Cola Cao sin gluten 250 g.,"4,69 €",11 g,345 Kcal,1438 KJ,0.05 g,18 g,27 g
Pan de molde integral 800 g,"2,59 €",3.2 g,256 Kcal,1081 KJ,1.2 g,44 g,9.2 g
Preparado de soja y coco Alpro sin gluten y sin lactosa 400 g.,"2,29 €",2.9 g,55.0 Kcal,230.0 KJ,0.24 g,2.4 g,3.9 g
Cereales de trigo integral y maíz tostados con chocolate Crunchy Brownie Chocapic Nestlé 300 g.,"3,69 €",4.6 g,385 Kcal,1629 KJ,0.22 g,74 g,8.3 g
Alitas de pollo estilo americano Recetas Crujientes La Cocinera 500 g.,"6,99 €",16 g,254 Kcal,1057 KJ,0.65 g,12 g,15 g
Queso de mezcla tierno mini Carrefour pieza de 990 g,"9,29 €",28 g,346 Kcal,1436 KJ,1.5 g,0.5 g,23 g
Menestra de verduras Carretilla sin gluten 300 g.,"3,39 €",7.2 g,103 Kcal,426 KJ,1.0 g,4.8 g,2.6 g
Queso fundido en porciones El Caserío sin gluten 250 g.,"2,49 €",15 g,209 Kcal,869 KJ,1.6 g,4.9 g,12 g
Teriyaki noodles con pollo Rana 400 g.,"5,39 €",4.0 g,135.0 Kcal,570.0 KJ,1.4 g,17.0 g,2.9 g
Mantequilla faácil de untar Président 250 g.,"4,85 €",80 g,727 Kcal,2989 KJ,2.0 g,1.0 g,0.7 g
Martini Rojo Vermouth,"14,25 €",0.0 g,145.0 Kcal,605.0 KJ,0.0 g,15.0 g,0.0 g
Queso grana padano en laminas D.O.P. Hispano Italiana Parmareggio 100 g.,"4,35 €",28.4 g,388 Kcal,1612 KJ,1.5 g,0 g,33 g
Macarrones integrales Carrefour 500 g.,"1,11 €",2 g,346 Kcal,1464 KJ,0.03 g,66 g,12 g
Galletas de chocolate y caramelo Mars 162 g.,"2,95 €",20.1 g,454 Kcal,1903 KJ,0.59 g,61.3 g,5.4 g
Mermelada de ciruela Classica Hero sin gluten 330 g.,"2,79 €",0.0 g,203 Kcal,862 KJ,0.0 g,50 g,0.4 g
Queso de oveja viejo graso Flor de Esgueva tapas maestras ya cortado cuña de 210 g,"6,95 €",38 g,440 Kcal,1826 KJ,2.3 g,0.5 g,24 g
Chocolate negro 72% cacao con naranja Clavileño sin gluten y sin azúcar añadido 100 g.,"1,59 €",39 g,511 Kcal,2112 KJ,0.03 g,38 g,8.3 g
Miel de eucalipto Carrefour Classic' 500 g.,"4,19 €",0.0 g,332.0 Kcal,1411.0 KJ,0.0 g,83.0 g,0.0 g
Cocktail de snakcs con aceite de girasol XXL Aspil sin gluten 225 g.,"2,15 €",23 g,496 Kcal,2076 KJ,1.2 g,66 g,5.8 g
Carrefour Tallarines 4 Quesos 325 g.,"2,59 €",2.4 g,118 Kcal,498 KJ,0.7 g,19 g,4.3 g
Miel de flores antigoteo origen España Original Carrefour 500 g.,"4,35 €",0.0 g,330 Kcal,1404 KJ,0.01 g,82.0 g,0.6 g
Tarrito de pavo con verduras desde 6 meses ecológico Smileat sin gluten 230 g.,"2,89 €",2.6 g,55.4 Kcal,231.7 KJ,0.055 g,4.2 g,3.4 g
Queso de sandwich en lonchas Bredam 1 kg,"5,69 €",26 g,333 Kcal,1393 KJ,2 g,12 g,13 g
Pimientos del Piquillo enteros asados De Nuestra Tierra 260 g.,"5,15 €",0.5 g,48 Kcal,200 KJ,0.2 g,8.7 g,1.2 g
Salchichas classic Wieners Oscar Mayer sin gluten 200 g.,"1,33 €",20 g,233 Kcal,966 KJ,2 g,1.3 g,12 g
Mantequilla con sal Lurpak 200 g.,"3,99 €",82 g,739 Kcal,3038 KJ,1.2 g,0.7 g,0.6 g
Leche infantil de continuación desde 6 meses líquida Nestlé Nan Optipro 2 brik 500 ml.,"2,79 €",3.2 g,67 Kcal,280 KJ,,8.3 g,1.1 g
"Condimento para arroz, sushi y salsas Mirin Blue Dragon 150 ml.","6,39 €",1.4 g,321.0 Kcal,1363.0 KJ,0.25 g,75.5 g,0.1 g
"Chicles sabor hierbabuena Trident sin azúcar 82,6 g.","3,09 €",0.2 g,163 Kcal,677 KJ,0.02 g,66 g,0.1 g
Mini Snack de Fuet XXL Campofrío sin gluten 140 g,"3,19 €",42 g,510 Kcal,2117 KJ,5 g,4.1 g,29 g
Choco bolas Nestlé Extrafino 140 g.,"2,65 €",25.0 g,507 Kcal,2122 KJ,0.71 g,61.9 g,7.0 g
Refresco Lima Limón Zero Carrefour Classic' 2 l.,"0,84 €",0 g,0 Kcal,2 KJ,0.02 g,0.5 g,0 g
Café soluble natural Nescafé Classic 200 g.,"6,65 €",0.2 g,118 Kcal,484 KJ,0.25 g,3.1 g,7.8 g
Cerveza Carrefour Lager botella 1 l.,"1,05 €",0.1 g,46 Kcal,192 KJ,0.02 g,3 g,0.28 g
Castañas enteras peladas al fuego Extra Carrefour 100 g,"1,40 €",0.9 g,166 Kcal,704 KJ,,37 g,2.8 g
"Aceite de oliva original 0,4º Carbonell 5 l.","54,90 €",100 g,900 Kcal,3700 KJ,0 g,0 g,0 g
Supremas de salmón sin piel congelado Findus 200 g.,"10,55 €",23 g,287 Kcal,1191 KJ,0.15 g,0 g,20 g
Pizza de atún y bacon La Originale Palacios 405 g.,"3,15 €",6.8 g,242 Kcal,1019 KJ,1.7 g,34 g,10 g
Piccolinis frankfurt Buitoni 270 g.,"4,25 €",8.5 g,236 Kcal,990 KJ,0.90 g,29.6 g,9.3 g
Coca Cola zero azúcar pack 24 latas 33 cl.,"20,40 €",0 g,0.2 Kcal,0.9 KJ,0.02 g,0 g,0 g
Pistachos tostados sin sal añadida Carrefour 150 g.,"2,15 €",47 g,596 Kcal,2467 KJ,0.21 g,15 g,23 g
Barra de pan baja en sal Carrefour 250 g,"0,55 €",2.9 g,288 Kcal,1221 KJ,0.02 g,55 g,9.8 g
Aceitunas verdes rellenas de pasta de anchoa Carbonell lata 150 g,"2,19 €",100 g,156 Kcal,641 KJ,0 g,0 g,0 g
Patatas fritas en aceite de oliva virgen extra Frit Ravich 160 g.,"2,25 €",31 g,545 Kcal,2276 KJ,0.9 g,58 g,6.4 g
Chorizo Ibérico Extra Cular Carrefour el Mercado sin gluten 260 g,"4,90 €",36 g,427 Kcal,1771 KJ,3.2 g,0.8 g,25 g
Pan dulce Schär sin gluten y sin lactosa 200 g.,"3,49 €",6.6 g,280 Kcal,1181 KJ,0.59 g,50 g,2.9 g
Empanada gourmet de atún Carrefour 1 kg,"9,99 €",6 g,237 Kcal,997 KJ,1.23 g,36.77 g,7.6 g
Crocanti de almendras con caramelo Vahiné 100 g.,"4,15 €",26.5 g,511 Kcal,2137 KJ,0.5 g,53.2 g,11.5 g
Yemas de espárragos blancos delgados Carrefour pack de 2 unidades de 135 g.,"3,49 €",0 g,15 Kcal,62 KJ,0.75 g,1.8 g,1.2 g
Maíz frito y salado Carrefour 200 g.,"1,87 €",14 g,434 Kcal,1822 KJ,1.5 g,66 g,5.7 g
Garbanzos con su sofrito ecológico Litoral sin gluten 425 g.,"2,99 €",3.3 g,107 Kcal,450 KJ,0.85 g,12.9 g,4.9 g
Galletas recubiertas de chocolate con leche Digestive Carrefour Sensation 300 g.,"0,95 €",20 g,463 Kcal,1942 KJ,1.4 g,63 g,6.0 g
Yogur desnatado proteína stracciatella Danone sin gluten sin azúcar añadido pack de 4 unidades de 105 g.,"2,15 €",0.5 g,49 Kcal,204 KJ,0.1 g,4.8 g,6.2 g
Galletas de cereales con chocolate Chiquilín Artiach 395 g.,"3,85 €",15 g,458 Kcal,1924 KJ,1.3 g,71 g,7.5 g
Crema de avellanas y cacao con soja Valsoia sin gluten y sin lactosa 200 g.,"3,85 €",28 g,514 Kcal,2148 KJ,0.01 g,57 g,5.2 g
Galletas rellenas de crema de cacao Schär sin gluten  250 g.,"3,99 €",19 g,474 Kcal,1988 KJ,0.45 g,70 g,4.2 g
Taquitos de Jamón Curado Light Sánchez Alcaraz sin gluten y sin lactosa 100 g,"2,39 €",5 g,173 Kcal,729 KJ,5 g,1 g,31 g
Arroz redondo integral ecológico Carrefour Bio 1 kg.,"3,15 €",1.9 g,361 Kcal,1529 KJ,0.02 g,77 g,7.5 g
Tumaca con ajo y aceite de oliva Carrefour 370 g.,"1,91 €",4.2 g,56 Kcal,234 KJ,1.02 g,6.1 g,1.1 g
Café latte espresso Carrefour Sensation sin gluten 250 ml.,"0,72 €",1.2 g,57 Kcal,240 KJ,0.15 g,8.8 g,2.7 g
Boldo en bolsitas Pompadour 20 ud.,"2,75 €",0.1 g,1 Kcal,3 KJ,0.01 g,0.1 g,0.1 g
Bizcocho con pepitas de chocolate con leche y relleno de chocolate Milka 350 g.,"5,49 €",21 g,435 Kcal,1815 KJ,0.78 g,57 g,5.3 g
Salchichas de pollo ecológica Carrefour Bio 300 g,"6,29 €",14 g,191 Kcal,793 KJ,1.3 g,0.5 g,15 g
Fideos de chocolate Vahiné 71 g.,"2,39 €",2.5 g,404 Kcal,1714 KJ,0 g,93 g,1.6 g
Salsa tártara Sensation Carrefour 340 g.,"1,54 €",57 g,536 Kcal,2205 KJ,2.1 g,4.1 g,1.2 g
Yllera Vendimia Nocturna Verdejo Blanco 2022,"7,09 €",0.1 g,80 Kcal,334 KJ,0 g,1.8 g,0.3 g
Taco de bacalao extra al punto de sal congelado 400 g,"7,29 €",1.5 g,62 Kcal,260 KJ,1.5 g,0 g,12 g
Galletas con naranja recubiertas con chocolate Pim´s Fontaneda 150 g.,"3,15 €",13 g,397 Kcal,1670 KJ,0.44 g,66 g,3.3 g
Matcha latte Origen&Sensations compatible con Dolce Gusto 10 unidades de 10 g.,"4,45 €",7.9 g,400.0 Kcal,1723.2 KJ,0.5 g,52.7 g,28.3 g
Flan de dulce de leche Carrefour sin gluten pack de 4 unidades de 100 g.,"2,25 €",6.2 g,167 Kcal,702 KJ,0.16 g,24 g,3.7 g
Queso semicurado mezcla mini García Baquero pieza 930 g,"18,65 €",34.5 g,416.5 Kcal,1727 KJ,1.8 g,1.5 g,25 g
Rollitos de primavera  Carrefour 280 g,"3,35 €",3 g,127 Kcal,535 KJ,2 g,22 g,3 g
Vino tinto joven tempranillo Marqués Dospalacios Vendimia Seleccionada 75 cl.,"1,45 €",0.50 g,77 Kcal,319 KJ,0.010 g,0.50 g,1 g
Patatas fritas onduladas Carrefour 350 g.,"2,25 €",36 g,553 Kcal,2303 KJ,0.92 g,49 g,6.6 g
Salsa de miel y mostaza Carrefour Classic sin gluten envase 300 g.,"1,16 €",38 g,404 Kcal,1667 KJ,2.4 g,14 g,1.0 g
Regaliz Oro Haribo 125 g.,"3,25 €",0.7 g,317 Kcal,1343 KJ,1.2 g,74 g,3 g
Fusilli de guisantes ecológicos Carrefour Bio sin gluten 250 g.,"3,19 €",1.8 g,344 Kcal,1456 KJ,0.08 g,57 g,20 g
Tortitas de arroz y quinoa ecológicas Ecocesta sin gluten 120 g.,"1,81 €",3.0 g,380 Kcal,1609 KJ,0.56 g,77 g,8.5 g
Crema de chocolate Danone Vitalinea sin gluten pack de 4 unidades de 125 g.,"3,09 €",0.90 g,86 Kcal,362 KJ,0.22 g,15 g,3.80 g
Galletas de cereales Mini Arluy 275 g.,"3,25 €",17 g,469 Kcal,1964 KJ,1.02 g,72 g,5.9 g
Bony Bimbo 3 ud.,"2,45 €",20 g,414 Kcal,1732 KJ,0.83 g,52 g,4 g
Chocolate blanco Nestlé Milkybar 100 g.,"1,69 €",32.5 g,554 Kcal,2315 KJ,0.28 g,59.6 g,5.3 g
Cacahuetes fritos salados con miel Eagle sin gluten 250 g.,"5,05 €",48 g,611 Kcal,2534 KJ,0.6 g,17 g,25 g
Dulce de membrillo Emily Foods sin gluten 400 g.,"1,61 €",0.5 g,229 Kcal,974 KJ,0.14 g,57 g,0.5 g
"Zumo de piña, plátano y coco Carrefour Selección exprimido botella 75 cl.","2,19 €",0.6 g,56 Kcal,238 KJ,,12 g,0.50 g
Bebida espumosa sin alcohol Champín sin gluten 75 cl.,"3,69 €",0.5 g,14 Kcal,61 KJ,0.023 g,3.6 g,0.5 g
Tinta de sepia esterilizada 90 g,"2,99 €",0.1 g,50.0 Kcal,210.0 KJ,8.3 g,4.7 g,7.3 g
Crema de queso piña Arla 200 g.,"2,15 €",20.0 g,244.0 Kcal,1011.0 KJ,0.8 g,11.0 g,4.0 g
Salsa barbacoa con miel HP envase 465 g.,"4,05 €",29 g,350 Kcal,1445 KJ,1.8 g,20 g,1.9 g
Dunis de azúcar La Santiña sin gluten pack de 2 unidades de 50g.,"2,19 €",22.1 g,370 Kcal,1549.12 KJ,0.5 g,39.5 g,2.2 g
Caldo de pollo Carrefour sin gluten brik 1 l.,"0,75 €",0 g,5 Kcal,21 KJ,0.89 g,0.6 g,0 g
Galletas maría Marbú Dorada Artiach 800 g.,"4,49 €",17 g,475 Kcal,1997 KJ,0.88 g,73 g,6.5 g
Estofado de Pavo Adobado al Ajillo 500 g aprox,"3,17 €",1.8 g,84 Kcal,356 KJ,1.63 g,1 g,16.1 g
Miel de flores Carrefour 500 g.,"3,89 €",0.0 g,330 Kcal,1404 KJ,0.02 g,82.0 g,0.6 g
Cune Afrutado Semidulce,"6,29 €",1 g,79 Kcal,327 KJ,1 g,3.3 g,2 g
Café molido natural descafeinado Lavazza 250 g.,"5,35 €",13.6 g,342.0 Kcal,1410.0 KJ,0.03 g,15.9 g,13.6 g
Queso de oveja curado manchego artesano D.O.P. De Nuestra Tierra 125 g,"5,79 €",36 g,438 Kcal,1815 KJ,1.8 g,1.4 g,27 g
Helado Pirulo Fantasmikos Nestlé sin gluten 15 ud.,"5,09 €",12 g,230 Kcal,962 KJ,0.03 g,30 g,0.5 g
Leche semidesnatada Central Lechera Asturiana sin lactosa brik 1 l.,"1,38 €",1.55 g,45 Kcal,190 KJ,0.1 g,4.65 g,3.15 g
Queso Queso Gruyère IGP France Reflets de France 250 g,"6,85 €",32 g,389 Kcal,1614 KJ,1 g,0 g,25 g
Arroz bomba Sos 1 kg.,"5,89 €",0.70 g,357 Kcal,1514 KJ,0 g,80 g,7.10 g
Bombones surtidos Nestlé Caja Roja estuche 11 ud.,"3,75 €",33.3 g,551.0 Kcal,2297.0 KJ,0.15 g,54.7 g,6.6 g
Fanta de limón botella 50 cl.,"1,58 €",0 g,19.0 Kcal,80.0 KJ,0.02 g,4.4 g,0 g
Preparado para tortitas y crepes Carrefour 200 g.,"1,99 €",5.6 g,346 Kcal,1465 KJ,1.5 g,58 g,16 g
Tacos de atún de aleta amarilla congelado Extra Carrefour 255 g.,"4,65 €",1.6 g,118 Kcal,498 KJ,0.22 g,0.8 g,25 g
Hummus tradicional Simpl sin gluten 200 g.,"0,99 €",18 g,235 Kcal,972 KJ,,8.1 g,7.3 g
Queso de mezcla semicurado Gran Capitán pieza de 930 g,"17,75 €",33 g,395 Kcal,1638 KJ,1.7 g,0.5 g,23 g
Vino tinto de mesa Vegas del Rivilla 2 l.,"2,29 €",0.50 g,88 Kcal,362 KJ,0.014 g,0.50 g,1 g
Sardinillas con salsa picantona Classic Carrefour 60 g.,"1,24 €",14.0 g,200 Kcal,831 KJ,1.00 g,0.7 g,17.7 g
Galleta rellena de chocolate con leche Lotus Biscoff 150 g.,"1,76 €",24.0 g,504.0 Kcal,2112.0 KJ,0.72 g,67.0 g,5.2 g
Chorizo extra dulce herradura Ezequiel sin gluten 425 g.,"6,49 €",38.67 g,465 Kcal,1928 KJ,2.75 g,2.51 g,26.71 g
"Coca Cola pack 2 botellas 1,25 L.","2,90 €",0 g,42 Kcal,180 KJ,0 g,10.6 g,0 g
Libritos de lomo con jamón cocido y queso edam 230 g,"5,70 €",9.6 g,219 Kcal,918 KJ,0.8 g,12.8 g,19.9 g
Chocolate negro 70% sin azúcar añadido Valor sin gluten 180 g.,"3,29 €",35.8 g,481 Kcal,1986 KJ,0.1 g,33.7 g,10.5 g
Rosquillas de pan Tarallini Casarecci Gran Forno di Plugia 250 g.,"2,25 €",16.4 g,454 Kcal,1903 KJ,2.6 g,67.6 g,8.7 g
Batido de vainilla 40% menos azúcar Puleva sin gluten botella 1 l.,"2,15 €",1.0 g,54 Kcal,229 KJ,0.15 g,8.3 g,3.0 g
Salsa burger Carrefour envase 350 g.,"1,83 €",52 g,538 Kcal,2220 KJ,2.1 g,16 g,1.4 g
Pan Rústico Redondo Airos sin gluten y sin lactosa 85 g,"0,95 €",3.7 g,228 Kcal,961 KJ,1.2 g,47 g,1.9 g
Batido de vanilla Okey botella 750 ml.,"1,75 €",1.3 g,65 Kcal,273 KJ,0.13 g,11 g,1.9 g
Leche infantil de continuación desde 6 meses Nestlé Nan Supreme Pro 2 sin aceite de palma lata 800 g.,"28,20 €",23.3 g,490 Kcal,2053 KJ,,60.5 g,9.3 g
Pasta fideuá Gallo 450 g.,"1,39 €",2 g,344 Kcal,1458 KJ,0.03 g,68 g,12 g
Yogur griego con tarta de arándanos Danone Oikos pack de 2 unidades de 110 g.,"1,93 €",8.4 g,156.0 Kcal,652.0 KJ,0.09 g,16.8 g,3.2 g
Alubia pinta cocida Carrefour 400 g.,"1,06 €",0.7 g,95 Kcal,400 KJ,0.6 g,13 g,6.2 g
Albóndigas en salsa Simpl 415 g.,"1,16 €",9.6 g,146 Kcal,606 KJ,1 g,5.1 g,9.2 g
Espaguetis Gallo sin gluten 450 g.,"2,19 €",2.3 g,361 Kcal,1532 KJ,0.15 g,78 g,6.4 g
"Barritas de chocolate con leche, crema de cacahuete, caramelo y cacahuetes Snickers 3 ud.","3,05 €",23.0 g,481.0 Kcal,2018.0 KJ,0.63 g,61.0 g,8.6 g
Queso de mezcla semicurado tradicional Campo Real cuña de 250 g,"5,39 €",34 g,425 Kcal,1736 KJ,1.78 g,3.22 g,26.5 g
Hamburguesa de añojo Calidad y Origen Carrefour 2x150 g,"3,65 €",14.5 g,209 Kcal,870 KJ,1 g,0.5 g,20.3 g
Paté de atún en aceite La Piara pack de 2 unidades de 75 g.,"3,95 €",12 g,179 Kcal,743 KJ,1.6 g,5.8 g,11 g
Viena gourmet pequeña Carrefour 1 ud.,"0,25 €",1.1 g,248 Kcal,1038 KJ,1.6 g,50 g,8.4 g
Gelatina light sabor fresa sin azúcar añadido Carrefour sin gluten pack de 6 unidades de 100 g.,"0,99 €",0 g,9 Kcal,37 KJ,0.1 g,2.2 g,0 g
Muga Crianza 2020,"18,60 €",0.0 g,0.0 Kcal,0.0 KJ,0.0 g,0.0 g,0.0 g
Mini sandwich sabor vainilla Sensation Carrefour 6 ud.,"2,79 €",13.0 g,295.0 Kcal,1236.0 KJ,0.18 g,39.0 g,4.8 g
Crema balsámica de frambuesa Carrefour 250 ml.,"4,29 €",0 g,226 Kcal,963 KJ,0.04 g,55 g,0.5 g
Café molido mezcla descafeinado Carrefour 250 g.,"1,70 €",12.0 g,322.0 Kcal,1326.0 KJ,0.1 g,13.0 g,12.6 g
Chocolate con leche y almendras con naranja Pancracio sin gluten 100 g.,"3,49 €",39.0 g,568.0 Kcal,2361.0 KJ,0.14 g,42.0 g,9.1 g
Aperitivo de maiz sabor queso Chitos Carrefour sin aceite de palma 115 g.,"0,99 €",29 g,520 Kcal,2173 KJ,1.4 g,58 g,5.6 g
Mostaza Orlando sin gluten envase 290 g.,"1,68 €",3.6 g,87 Kcal,363 KJ,1.1 g,8.2 g,3.7 g
Membrillo en lonchas Santa Teresa sin gluten 150 g.,"3,35 €",0.5 g,263 Kcal,1117 KJ,0.02 g,62 g,0.3 g
Chocolate con leche y avellanas enteras Valor sin gluten 250 g.,"3,89 €",38.2 g,568 Kcal,2365 KJ,0.28 g,44.3 g,9.3 g
Napolitanas con chocolate Carrefour Classic´ 6 ud.,"3,99 €",24 g,421 Kcal,1757 KJ,1 g,42 g,8 g
Flan de café Salzillo Reina sin gluten pack de 4 unidades de 100 g.,"2,19 €",6.4 g,160 Kcal,669 KJ,0.13 g,22 g,4 g
Picatostes fritos sabor clásico Carrefour 75 g.,"0,64 €",24 g,494 Kcal,2068.28 KJ,1 g,58 g,10 g
Galletas de Cereales y Chocolate Florbú sin Azúcares Añadidos 370 g.,"2,75 €",17 g,432 Kcal,1810 KJ,0.65 g,67 g,7.6 g
Bocaditos Carrefour 370 g.,"2,09 €",27 g,464 Kcal,1938 KJ,0.78 g,48 g,6.1 g
Escalope Empanado 220 g,"5,65 €",8.5 g,196 Kcal,820 KJ,,12 g,16 g
Pan tostado normal Recondo 270 g.,"2,79 €",4.0 g,383.0 Kcal,1621.0 KJ,1.2 g,72.0 g,12 g
Yogur natural desnatado con leche de oveja pasteurizada ecológica Carrefour Bio 420 g.,"3,45 €",0 g,36 Kcal,152 KJ,0 g,3 g,6 g
Refresco de manzana Trina sin gas lata 33 cl.,"0,72 €",0.0 g,41 Kcal,175 KJ,0.10 g,10.0 g,0.0 g
Lomos de Salmón Ecológico Carrefour Bio 220 g,"9,20 €",16 g,224 Kcal,932 KJ,0.1 g,0 g,20 g
"Carrefour té de melocotón botella 1,5 l.","0,85 €",0.5 g,23 Kcal,97 KJ,0.03 g,5.4 g,0.5 g
Caldo de pescado Carrefour 12 pastillas,"0,89 €",9 g,213 Kcal,892 KJ,52.3 g,24 g,8.7 g
