name,price,grasa,calorias,kJ,sal,carbohidratos,proteinas
"Lomo de cebo ibérico 50% raza ibérica Carrefour sin gluten 2x62,5 g","4,85 €",21 g,331 Kcal,1386 KJ,4 g,1.4 g,34 g
Lomo en lonchas Carrefour Classic' sin gluten sin lactosa 80 g.,"1,90 €",4 g,194 Kcal,820 KJ,5 g,1.5 g,38 g
Butifarra Carrefour 500 g aprox,"4,37 €",16.9 g,211.2 Kcal,876.4 KJ,1.93 g,0.83 g,14.54 g
Pan hamburguesa Carrefour No Gluten sin gluten y sin lactosa 180 g.,"1,81 €",6.5 g,220.0 Kcal,992.0 KJ,,35.6 g,1.4 g
Café molido mezcla Gran Aroma Marcilla 250 g.,"3,45 €",12 g,332 Kcal,1370 KJ,0.02 g,16 g,17 g
Arroz de montaña vegetal Bo de Debò 280 g,"4,39 €",6.6 g,172.0 Kcal,722.0 KJ,1.12 g,22.0 g,4.7 g
Leche semidesnatada con calcio Carrefour brik 1 l.,"0,99 €",1.6 g,49 Kcal,205 KJ,0.13 g,4.7 g,3.9 g
Barritas de avena y chocolate negro Crunchy Nature Valley sin lactosa pack de 5 unidades de 42 g.,"2,65 €",19.8 g,473 Kcal,1981 KJ,0.65 g,61.5 g,8.7 g
Pan molde integral con 8 cereales y semillas Bimbo Silueta 600 g.,"3,05 €",3.2 g,249 Kcal,1050 KJ,1.0 g,41 g,11 g
Filete de caballa en aceite de oliva Isabel 85 g.,"3,35 €",27 g,313 Kcal,1297 KJ,1.2 g,0 g,18 g
Pizza de atún y bacon Casa Tarradellas 405 g.,"3,29 €",11 g,263 Kcal,1104 KJ,1.4 g,27 g,14 g
Aceite de Aguacate La Masía 250 ml.,"5,19 €",100 g,900 Kcal,3700 KJ,0 g,0 g,0 g
Corazones de alcachofa 8/10 Carrefour 240 g.,"1,93 €",0 g,26 Kcal,109 KJ,0.43 g,4 g,1.4 g
Galletas bañadas chocolate blanco sabor caramelo salado Filipinos Artiach 128 g.,"1,53 €",27 g,523 Kcal,2188 KJ,0.61 g,64 g,5.4 g
Caldo natural de cocido Gallo sin gluten y sin lactosa brik 1 l.,"1,99 €",0.2 g,7 Kcal,31 KJ,0.98 g,0.2 g,1.2 g
Galletas de chocolate rellenas de crema bañadas en chocolate blanco Oreo 246 g.,"3,15 €",25 g,532 Kcal,2228 KJ,0.54 g,70 g,4.9 g
Masa redonda Brisa Buitoni 230 g.,"2,59 €",19.3 g,377 Kcal,1575 KJ,1.1 g,40.9 g,6.2 g
Queso fundido en porciones La Vaca Que Ríe sin gluten 250 g.,"2,79 €",12.5 g,179 Kcal,743 KJ,1.9 g,5.5 g,11 g
Hummus con aceitunas kalamata Carrefour Extrea sin gluten 240 g,"1,38 €",21 g,266 Kcal,1103 KJ,1.1 g,11 g,6.1 g
Zumo tropical Carrefour pack de 6 briks de 20 cl.,"1,99 €",,45 Kcal,190 KJ,,11 g,
Geles dulces multicolor Vidal 290 g.,"3,99 €",2.2 g,368 Kcal,1560 KJ,0.42 g,82 g,2.2 g
Galletas con cinco cereales y chocolate Classic Carrefour 400 g.,"2,19 €",14 g,430 Kcal,1804 KJ,0.58 g,64 g,8 g
Crema de queso curado con aceite de oliva virgen extra Carrefour Extra 110 g.,"2,35 €",11.6 g,173.0 Kcal,720.0 KJ,1.51 g,10.4 g,6.7 g
Salsa chili dulce King Tiger 250 ml.,"2,45 €",0 g,184 Kcal,782 KJ,2 g,46 g,0 g
Postre infantil de coco con mango y kiwi desde 6 meses ecológico Gerber pack de 4 unidades de 90 g.,"3,99 €",2.9 g,72 Kcal,302 KJ,0.02 g,10.2 g,0.8 g
Queso mini de cabra al pimentón Carrefour Extra 400 g,"8,15 €",37 g,419 Kcal,1734 KJ,1.3 g,1.6 g,21 g
Galletas rellenas de cacao Carrefour Classic sin gluten 120 g.,"2,19 €",19 g,476 Kcal,1997 KJ,0.83 g,68 g,6.9 g
Crema de avena para cocinar ecológico Oatly 250 ml.,"1,17 €",13 g,150 Kcal,600 KJ,0 g,6 g,1 g
Calamares en su tinta Montey pack de 3 de 51 g.,"1,35 €",19.97 g,8.10 Kcal,1180.00 KJ,0.45 g,8.10 g,17.90 g
Cider Ladrón de manzanas lata 33 cl.,"1,45 €",0 g,52 Kcal,220 KJ,0.01 g,6.6 g,0 g
Empanada rectangular vegana Carrefour 800 g,"5,35 €",8.6 g,238 Kcal,1001 KJ,0.72 g,35 g,4.3 g
Pizza 4 formaggi La Mia Grande Dr. Oetker 400 g.,"5,39 €",10.0 g,252 Kcal,1059 KJ,1.5 g,27 g,2 g
Cerveza Desperados sabor mojito botella 33 cl.,"1,32 €",0 g,62 Kcal,261 KJ,0.01 g,7 g,0 g
Atún claro en aceite de girasol Carrefour pack de 3 latas de 104 g.,"3,90 €",5.9 g,153 Kcal,643 KJ,1.5 g,0.5 g,25 g
Falafel vegetal ultracongelado Sensation Carrefour 500 g.,"5,49 €",6.8 g,185 Kcal,772 KJ,0.55 g,18 g,8.5 g
Muslitos de mar Carrefour 500 g.,"3,05 €",1.9 g,148.0 Kcal,627.0 KJ,1.4 g,25.0 g,7.8 g
Crema de bogavante con un toque de hinojo y cilantro Knorr 61 g.,"1,95 €",1 g,33 Kcal,140 KJ,0.8 g,4.3 g,1.6 g
Chicle de sandía Senses Trident pack de 3 unidades de 23 g.,"2,49 €",1.5 g,170 Kcal,710 KJ,0.01 g,63 g,0.4 g
Espinacas en hojas Findus 1 kg.,"4,49 €",0.8 g,29 Kcal,120 KJ,0.04 g,0.5 g,3.1 g
Azúcar moreno de caña in integral Classic´ Carrefour 1 kg.,"2,05 €",,402 Kcal,1709 KJ,0.01 g,100 g,0.5 g
Crema de cacao con avellanas original sin azúcar añadido Nocilla sin gluten 180 g.,"3,05 €",29 g,439 Kcal,1813 KJ,0.1 g,53 g,4.3 g
Caramelos sabor limón Smint pack de 2 paquetes de 50 ud.,"3,99 €",0.8 g,243 Kcal,1013 KJ,0.25 g,94 g,0 g
Chocolate negro intenso con naranja Lindt Excellence pack de 2 tabletas de 100 g.,"6,45 €",34 g,538 Kcal,2240 KJ,0.11 g,47 g,8 g
Zumo de arándano Ocean Spray light brik 1 l.,"2,05 €",0 g,8 Kcal,33.49 KJ,0 g,1.5 g,0 g
Leche entera Central Lechera Asturiana brik 1 l.,"1,14 €",3.6 g,63 Kcal,264 KJ,0.1 g,4.6 g,3.1 g
Bebida de clara de huevo Wovo sin gluten y sin lactosa 1 l.,"2,59 €",0.0 g,12.0 Kcal,50.0 KJ,0.1 g,0.0 g,2.8 g
Mini bocaditos de pan sour cream Sensation Carrefour 100 g.,"1,36 €",29 g,512 Kcal,2140 KJ,2.5 g,55 g,7.6 g
Salvado de avena Carrefour 500 g.,"1,83 €",11 g,376 Kcal,1374 KJ,0.14 g,49 g,13 g
Pasta con salmón salvaje con salsa cremosa de hierbas aromáticas desde 1 año ecológico Hipp 250 g.,"3,65 €",2.0 g,70.0 Kcal,292.0 KJ,0.0 g,8.0 g,3.0 g
"Barritas de chocolate con leche, galleta y caramelo Twix Minis 227 g.","3,99 €",24.0 g,493.0 Kcal,2065.0 KJ,0.40 g,65.0 g,4.4 g
Leche fermentada fresa y plátano Carrefour Classic' sin gluten sin lactosa pack de 4 unidades de 160 g.,"1,99 €",1 g,68 Kcal,281 KJ,0.13 g,11 g,2.4 g
Pizza espinacas y ricota Tradizionale Dr. Oetker 415 g.,"4,59 €",6.8 g,208 Kcal,873 KJ,0.97 g,27 g,7.9 g
Galletas de 5 cereales y leche Carrefour Classic 400 g.,"1,75 €",14 g,443 Kcal,1864 KJ,0.80 g,69 g,7.4 g
Galletas con pepitas de chocolate con leche y caramelo Schär sin gluten 150 g.,"4,39 €",23 g,484 Kcal,2028 KJ,0.8 g,61 g,7.3 g
Paté de pavo La Piara 125 g.,"4,39 €",17 g,214 Kcal,889 KJ,1.5 g,4 g,11 g
Cereales rellenos de avellanas y chocolate ecológico Carrefour Bio 375 g.,"2,75 €",12 g,421 Kcal,1769 KJ,0.38 g,65 g,9.2 g
Gamba cristal enharinada congelados Delfin 250 g.,"5,49 €",1.3 g,139 Kcal,587 KJ,1.1 g,16 g,15 g
Batido de chocolate Milka pack de 3 briks de 200 ml.,"1,91 €",1.1 g,71 Kcal,300 KJ,0 g,,11 g
Aceitunas verdes chupadedos El Faro 500 g.,"2,69 €",18 g,184 Kcal,756 KJ,3.8 g,0.7 g,1.3 g
Barra de pan pistola Carrefour 250 g,"0,47 €",1.1 g,272 Kcal,1138 KJ,1.3 g,55 g,8.8 g
Galletas María mini Carrefour Classic sin aceite de palma 350 g.,"1,46 €",9.7 g,430 Kcal,1815 KJ,0.85 g,77 g,7.5 g
Fuet de Pavo Campofrío Pavofrío sin gluten pieza de 150 g,"3,29 €",42 g,478 Kcal,1979 KJ,4 g,3 g,22 g
Mantequilla fácil de untar Président 250 g.,"4,29 €",82 g,743 Kcal,3054 KJ,0.03 g,0.5 g,0.7 g
Barritas de chocolate blanco con trocitos de frutos rojos Bicentury 90 g.,"3,25 €",25 g,504 Kcal,2110 KJ,0.5 g,62 g,5.9 g
Remolacha en rodajas Classic Carrefour 250 g.,"1,60 €",0 g,56 Kcal,236 KJ,0.48 g,10 g,1.5 g
Masa de hojaldre Carrefour No gluten sin gluten 280 g.,"2,79 €",20 g,354 Kcal,1482.13 KJ,0.98 g,37 g,2.5 g
Cerveza San Miguel Magna pack de 6 botellas de 25 cl.,"4,39 €",0 g,51 Kcal,211 KJ,0 g,4.3 g,0.3 g
Tinto de verano Sandevid con limón sin alcohol sin azúcar lata 25 cl.,"0,79 €",0 g,1 Kcal,39.0 KJ,3.00 g,0 g,0 g
Sopa de pollo con Maravilla Gallina Blanca pack de 3 sobres de 85 g.,"2,65 €",0.2 g,28 Kcal,119 KJ,0.67 g,5.4 g,1 g
Galletas Rellenas de Crema de Chocolate Príncipe pack de 3 unidades de 300 g.,"5,39 €",17 g,469 Kcal,1969 KJ,0.49 g,71 g,6.2 g
Café molido mezcla Saimaza 500 g.,"5,69 €",12 g,332 Kcal,1370 KJ,0.02 g,16 g,17 g
Mortadela Di Bologna IGP Ferrarini España 100 g,"2,45 €",21 g,255 Kcal,1059 KJ,2.10 g,0.60 g,16 g
Sandwich de nata con caramelo Maxibon Waffle Nestlé 4 ud.,"5,75 €",17 g,333 Kcal,1392 KJ,0.12 g,42 g,3.4 g
Caramelo sabor arándano rojo sin azúcar Ricola 50 g.,"2,89 €",0 g,238 Kcal,993 KJ,0 g,96 g,0 g
Leche semidesnatada Président brik 1 l.,"1,16 €",1.6 g,46 Kcal,192 KJ,0.13 g,4.7 g,3.1 g
Chocolate negro suave con toque de sal Lindt Excellence 100 g.,"3,15 €",32 g,529 Kcal,2205 KJ,0.31 g,50 g,6.2 g
Paella marinera Apolo 1 kg.,"6,25 €",0.9 g,72 Kcal,305 KJ,0.4 g,2.4 g,12.5 g
Yogur líquido desnatado edulcorado sin azúcar añadido Carrefour 1 kg.,"1,45 €",0.5 g,29 Kcal,123 KJ,0.11 g,4.1 g,2.9 g
Yogur natural azucarado Danone sin gluten pack de 4 unidades de 120 g.,"0,99 €",2.2 g,72 Kcal,300 KJ,0.11 g,10.0 g,3.0 g
Pan batard Carrefour 1 ud,"2,39 €",0.6 g,263 Kcal,1115 KJ,1.4 g,53 g,9.7 g
Fideuá Carretilla sin aceite de palma pack de 2 unidades de 250 g.,"6,59 €",6.7 g,155 Kcal,649 KJ,1.6 g,16.9 g,6.4 g
Tomate frito estilo casero Solís pack 3 unidades de 100 g.,"2,15 €",7.0 g,102 Kcal,425 KJ,0.9 g,7.8 g,1.3 g
Mix de frutos secos ecológicos Carrefour Bio 125 g.,"2,19 €",60 g,615 Kcal,2535 KJ,0.01 g,9.4 g,4.7 g
Pechuga de pavo sin gras El Pozo Bienstar sin gluten sin lactosa 340 g.,"3,79 €",0.5 g,72 Kcal,304 KJ,1.8 g,2.3 g,14.5 g
Mousse de chocolate negro crujiente Nestlé After Eight pack de 4 unidades de 57 g.,"2,54 €",13.7 g,214 Kcal,893 KJ,0.16 g,18.1 g,4.2 g
Tomate entero pelado Celorrio 480 g.,"1,25 €",0 g,23 Kcal,97 KJ,0.28 g,3.5 g,0.8 g
Aceite de oliva virgen extra ecológico Oro de Génave 75 cl.,"10,25 €",92.0 g,825.0 Kcal,3389.0 KJ,0.0 g,0.0 g,0.0 g
Tomate frito Carrefour pack de 2 tarros de 550 g.,"1,99 €",3.7 g,78 Kcal,325 KJ,0.95 g,9.6 g,1 g
Queso mozzarella en lonchas Fiorucci 75 g.,"2,15 €",23 g,301 Kcal,1251 KJ,1.5 g,0.5 g,23 g
Té negro en bolsitas Ship 25 ud.,"0,86 €",0.0 g,1.0 Kcal,3.0 KJ,0.0 g,0.5 g,0.0 g
Helado strawberry cheescake Ben & Jerry’s 465 ml.,"7,79 €",12 g,216 Kcal,909 KJ,0.19 g,24 g,2.9 g
Soja texturizada fina ecológica Ecocesta 250 g.,"4,69 €",9.7 g,399.7 Kcal,1686.6 KJ,0.008 g,30 g,48.1 g
Atún claro con aceite de oliva Calvo pack de 3 latas de 56 g.,"4,85 €",6.7 g,148 Kcal,623 KJ,1.3 g,0.7 g,21.4 g
Chicles sabor hierbabuena sin azúcar 60 minutos Trident pack de 3 unidades de 20 g.,"2,29 €",0.5 g,181 Kcal,753 KJ,0.03 g,71.5 g,0.1 g
Salsa de mostaza y eneldo Extra Carrefour sin gluten 200 g.,"2,05 €",37 g,448 Kcal,1856 KJ,1.4 g,25 g,2.3 g
Sopa de tomate Heinz 400 g.,"2,15 €",3.0 g,59.0 Kcal,249.0 KJ,0.2 g,7.2 g,0.7 g
Delicias de verdura con calabaza y zanahoria Bonduelle 300 g.,"3,99 €",5.1 g,95 Kcal,395 KJ,0.7 g,7.3 g,3.4 g
Garbanzo pedrosillano cocido Pedro Luis 425 g.,"1,99 €",1 g,85 Kcal,357.9 KJ,0.9 g,11.7 g,5.2 g
Mejillones en salsa marinera con tomate y aceite de oliva Carrefour Classic 69 g.,"1,99 €",12.3 g,181.0 Kcal,753.0 KJ,1.5 g,5.0 g,12.0 g
Kétchup 50% menos azúcar y sal Heinz envase 550 g.,"4,05 €",0.1 g,64 Kcal,271 KJ,0.9 g,12 g,1.4 g
Barritas de cereales con chocolate negro Corny pack 6 unidades de 23 g.,"2,49 €",17 g,452 Kcal,1897 KJ,0.41 g,65 g,5.80 g
Lasaña Barbacoa La Cocinera 500 g.,"5,15 €",7.2 g,155 Kcal,648 KJ,0.74 g,15 g,7.1 g
Galletas de avena sin azúcar añadido Avenacol Cuétara 250 g.,"4,29 €",16 g,420 Kcal,1757 KJ,0.66 g,64 g,8 g
Gotas de chocolate negro Carrefour sin gluten 250 g.,"2,25 €",26.5 g,497 Kcal,2072 KJ,0.02 g,54 g,5.8 g
Tallarines a la Boloñesa 300 g,"3,45 €",8.6 g,167 Kcal,698 KJ,1.1 g,17.5 g,4.8 g
Natillas de vainilla Dhul sin lactosa pack de 4 unidades de 125 g.,"2,85 €",3 g,106 Kcal,446 KJ,0.12 g,17 g,2.7 g
Higos naturales ecológicos Your Karma Foods sin gluten doy pack 200 g.,"3,35 €",0.9 g,249 Kcal,1041 KJ,0.01 g,54.1 g,3.3 g
Verdura para paella congelada Carrefour 450 g.,"1,22 €",0.5 g,48.0 Kcal,202.0 KJ,0.13 g,7.2 g,2.1 g
Garbanzo lechoso categoría extra Carrefour 1 kg.,"2,65 €",6.9 g,333 Kcal,1394 KJ,0 g,36 g,19 g
Caldo casero de pescado Gallina Blanca sin gluten 1 l.,"2,19 €",0.2 g,6 Kcal,25 KJ,0.75 g,0.5 g,0.5 g
Ensaladilla Findus 1 kg.,"4,49 €",0 g,53 Kcal,224 KJ,0 g,10 g,1.9 g
Tomate frito ecológico Carrefour Bio sin gluten tarro 340 g.,"1,99 €",5.2 g,81 Kcal,336 KJ,0.94 g,7.1 g,0.8 g
Galletas con avena y almendra ecológicas Bio Darma sin lactosa 130 g.,"2,19 €",23.0 g,478.0 Kcal,2000.0 KJ,0.3 g,59.0 g,7.0 g
Salsa de quesos Carrefour sobre 140 g.,"1,13 €",8 g,143 Kcal,595 KJ,1.6 g,11 g,6 g
Galletas María sin sal y sin azúcares añadidos Carrefour Classic sin aceite de palma 600 g.,"2,35 €",13 g,408 Kcal,1709 KJ,0.01 g,58 g,9.0 g
Almeja Blanca del Pacífico cocida 450 g,"2,49 €",0.746 g,67 Kcal,281 KJ,0.24 g,5.32 g,9.86 g
Fideo nº0 Gallo 675 g.,"2,15 €",2 g,344 Kcal,1458 KJ,0.03 g,68 g,12 g
Pantera Rosa Bimbo 3 ud.,"2,45 €",24 g,448 Kcal,1875 KJ,1.1 g,54 g,3.7 g
Lomo embuchado bipack Carrefour sin gluten y sin lactosa 75x2 g,"2,59 €",6.2 g,207 Kcal,874 KJ,3.7 g,0.9 g,37 g
Salsa pesto alla genovese Barilla sin gluten tarro 190 g.,"3,39 €",46.0 g,482.0 Kcal,1989.0 KJ,,9.8 g,4.7 g
Chocolate con leche Lacasitos sin gluten 100 g.,"1,69 €",32.6 g,551 Kcal,2299 KJ,0.17 g,58.0 g,5.6 g
Paté de jamón Classic Carrefour sin gluten y sin lactosa 160 g.,"1,11 €",28 g,302 Kcal,1250 KJ,1.8 g,0.6 g,12 g
Galletas Campurrianas de espelta con pepitas de chocolate Artiach 320 g.,"4,15 €",17 g,460 Kcal,1931 KJ,0.83 g,69 g,6.2 g
Lazos de hojaldre blanco Carrefour Classic' 8 ud.,"3,49 €",22 g,449 Kcal,1880 KJ,,59 g,
Pasta espaguetis nº 5 Barilla 500 g.,"1,61 €",2 g,359 Kcal,1521 KJ,,70.9 g,12.8 g
"Chocolate suizo con leche, pasas y avellanas Lindt 300 g.","7,49 €",30 g,520 Kcal,2169 KJ,0.15 g,54 g,6.9 g
Bacón sabor ahumado en tiras Carrefour El Mercado sin gluten pack de 2 unidades de 100 g,"1,65 €",23 g,263 Kcal,1088 KJ,2.2 g,1 g,14 g
Galletas cacao minis Carrefour Classic 500 g.,"1,95 €",16 g,452 Kcal,1890 KJ,0.92 g,70 g,5.7 g
Bolitas de cheddar bites Fripozo 250 g.,"3,25 €",18 g,318 Kcal,1330 KJ,2 g,29 g,9.7 g
Chocolate caramelo sal Lindt 125 g.,"2,79 €",29 g,230 Kcal,2218 KJ,0.81 g,60 g,6.30 g
Pizza 4 quesos Carrefour 400 g.,"2,69 €",11 g,265 Kcal,1113 KJ,1.4 g,26 g,15 g
Morcilla de cebolla Carrefour 400 g,"3,49 €",25.70 g,308.6 Kcal,1279.1 KJ,2.25 g,11.33 g,7.99 g
Tiramisú con mascarpone café y cacao Zero+4 sin gluten 110 g.,"2,49 €",12.0 g,261.0 Kcal,1093.0 KJ,0.03 g,33.0 g,4.2 g
Miel de flores ecológica Carrefour Bio 500 g.,"5,95 €",0.0 g,332.0 Kcal,1411.0 KJ,0.0 g,83.0 g,0.0 g
Napolitana de mantequilla y chocolate Carrefour 6 ud,"3,50 €",20 g,409 Kcal,1710 KJ,1.1 g,47 g,8.6 g
Galletas de avena con chocolate con leche Avena Go! Carrefour Sensation 136 g.,"2,19 €",21 g,458 Kcal,1918 KJ,1 g,58 g,8 g
Mojama de Atún Extra Carrefour El Mercado 250 g,"9,99 €",1.2 g,186 Kcal,787 KJ,3.57 g,1.1 g,42.6 g
Leche infantil de continuación desde 6 meses en polvo Nestlé Nidina 2 pack de 2 unidades de 600 g.,"25,95 €",24.2 g,500 Kcal,2095 KJ,,62 g,8.5 g
Caldo natural de verduras Gallo sin gluten y sin lactosa brik 1 l.,"1,99 €",0.1 g,5 Kcal,22 KJ,0.78 g,0.8 g,0.4 g
Arándanos Carrefour Classic 650 g.,"4,05 €",,70 Kcal,295 KJ,,14 g,
Fabada Asturiana Litoral sin gluten 420 g.,"2,55 €",8.7 g,145 Kcal,604 KJ,0.81 g,7.6 g,6.5 g
Leche fermentada líquida natural Danone - Actimel sin gluten pack de 14 unidades de 100 g.,"6,99 €",1.6 g,73 Kcal,307 KJ,0.1 g,10.8 g,3 g
Natillas con galleta sin azúcar añadido Reina pack de 4 unidades 125 g.,"2,19 €",2.6 g,97 Kcal,410 KJ,0.20 g,14.5 g,3.1 g
Tallarines de arroz Go-Tan 250 g.,"2,55 €",0.8 g,345.0 Kcal,1515.0 KJ,0.03 g,79.4 g,7.5 g
Copa de chocolate con nata Nestlé La Lechera pack de 4 unidades de 100 g.,"2,49 €",8.0 g,155 Kcal,650 KJ,0.09 g,17.3 g,3.1 g
Barritas de cereales de arroz tostado con cacao y leche Choco Krispies Kellogg's pack de 6 unidades de 20 g.,"3,85 €",11 g,411 Kcal,1729 KJ,0.46 g,70 g,5.7 g
Zumo de tomate 100% Premium Granini botella 1 l.,"3,05 €",0.5 g,17 Kcal,73 KJ,0.7 g,3 g,0.8 g
Galletas de mantequilla ecológicas Carrefour Bio 167 g.,"1,66 €",13 g,451 Kcal,1901 KJ,1 g,74 g,8 g
Galletas finas con chocolate negro Digestive Fontaneda 170 g.,"2,55 €",24 g,502 Kcal,2103 KJ,0.7 g,62 g,6.2 g
Caramelos de goma Chamallows Tubular Haribo sin gluten 250 g.,"3,39 €",0.5 g,333 Kcal,1414 KJ,0.02 g,80 g,3.5 g
Nueces sin cáscara Carrefour 200 g.,"1,99 €",65 g,686 Kcal,2829 KJ,0.07 g,5.3 g,16 g
"Bolsita de pera, manzana y plátano desde 4 meses ecológico Gerber sin gluten y sin azúcar añadido pack 4 unidades 90 g.","5,49 €",0.1 g,64 Kcal,270 KJ,0.00 g,14.0 g,0.6 g
"Yogur líquido natural azucarado Carrefour Classic' 1,5 l.","2,05 €",1.3 g,69 Kcal,291 KJ,0.11 g,11 g,2.9 g
Pizza 4 quesos Rústica Dr. Oetker 555 g.,"5,49 €",9.2 g,249 Kcal,1045 KJ,1.1 g,28 g,12 g
Tarrito de melocotón y plátano desde 4 meses Hero Baby sin gluten 190 g.,"1,41 €",0.2 g,67 Kcal,282 KJ,0.01 g,14.5 g,0.8 g
Zumo de piña y mango Carrefour Selección exprimido botella 75 cl.,"2,19 €",0 g,51 Kcal,213.53 KJ,0 g,12 g,0.5 g
Bombones surtidos Nestlé Caja Roja estuche 800 g.,"20,30 €",33.3 g,551.0 Kcal,2297.0 KJ,0.15 g,54.7 g,6.6 g
Paleta de Cebo de Campo Ibérica 50% Raza Ibérica en lonchas Altanegra 90 g,"5,79 €",29.7 g,397.3 Kcal,1651.6 KJ,4.1 g,0.8 g,32.5 g
Harina de trigo de fuerza Santa Rita 1 kg.,"1,39 €",1.3 g,350.0 Kcal,1500.0 KJ,0.1 g,71.3 g,12.5 g
Café Capuccino en cápsulas Nescafe Dolce Gusto 16 unidades de 7 g.,"4,89 €",20.4 g,423 Kcal,1765 KJ,0.45 g,35.9 g,17.4 g
Tarrito de verduritas con pavo desde 6 meses Nestlé sin gluten 190 g.,"1,79 €",2.4 g,59 Kcal,245 KJ,0.03 g,6.0 g,2.6 g
Canelones de carne Price 300 g.,"0,89 €",5.1 g,130 Kcal,547 KJ,0.85 g,14 g,6.2 g
Galletas gaufrette de chocolate  Extra Carrefour 150 g.,"1,65 €",31 g,537 Kcal,2241 KJ,0.2 g,65 g,7.0 g
Mayonesa Hellmann's sin gluten y sin lactosa tarro 825 ml.,"5,85 €",61 g,552 Kcal,2314 KJ,1.1 g,2 g,0.7 g
Mermelada de melocotón categoría extra Carrefour 410 g.,"1,58 €",0 g,196 Kcal,833 KJ,0 g,48 g,0.5 g
Preparado para bizcochos Classic Carrefour No Gluten sin gluten 400 g.,"2,49 €",0.5 g,342.0 Kcal,1451.0 KJ,,79.0 g,4.7 g
Mayonesa Ybarra sin gluten y sin lactosa tarro 450 ml.,"2,55 €",69 g,641 Kcal,2637 KJ,1.2 g,3.4 g,0.9 g
Queso mascarpone Classic´ Carrefour 250 g.,"2,55 €",40 g,392 Kcal,1616 KJ,0.08 g,3.5 g,4.5 g
Queso curado de oveja Ossau Iraty DOP Reflets de France 230 g,"7,79 €",38 g,450 Kcal,1865 KJ,1.7 g,2 g,25 g
Copos de arroz y trigo integral Stylesse Carrefour 500 g.,"1,99 €",1.1 g,353 Kcal,1478 KJ,0.88 g,77 g,13 g
Lasaña boloñesa gratinada 700 g,"5,45 €",8.4 g,185.0 Kcal,777.0 KJ,0.71 g,22.2 g,5.2 g
Aceite de oliva Sabor 1º Carbonell 1 l.,"13,89 €",100 g,900 Kcal,3700 KJ,0 g,0 g,0 g
Geles dulces sabor fresa y pica pica Haribo 150 g.,"2,45 €",1.4 g,349 Kcal,1482 KJ,0.19 g,84 g,0.6 g
Queso curado ya cortado García Baquero 225 g,"5,35 €",35.5 g,425.5 Kcal,1764 KJ,2 g,1.5 g,25 g
Caramelos de goma Sugar Shuffle Fini 180 g.,"2,09 €",0.3 g,337 Kcal,1410.95 KJ,0.2 g,79 g,4.5 g
Cola Revoltosa 2 l.,"0,65 €",0 g,8 Kcal,35 KJ,0.05 g,1.9 g,0 g
Pasas sin pepitas Borges doy pack 150 g.,"2,25 €",0.7 g,308 Kcal,1304 KJ,0.04 g,70 g,2 g
Galletas Abbracci Mulino Bianco 350 g.,"3,79 €",23.5 g,491 Kcal,2056 KJ,0.625 g,60.9 g,7 g
Pechuga de Pavo en lonchas Noel Delizias sin gluten y sin lactosa 110 g,"2,35 €",0.9 g,87 Kcal,370 KJ,1.8 g,1.8 g,18 g
Complemento alimenticio desde 12 meses sabor fresa Pediasure 850 g.,"28,60 €",3.93 g,100 Kcal,421 KJ,0.15 g,13.05 g,3 g
Queso havarti en lonchas con jalapeños Arla 150 g.,"3,49 €",34.0 g,397.0 Kcal,1645.0 KJ,1.7 g,0.7 g,22.0 g
Cachuetes fritos Carrefour 250 g.,"1,05 €",50 g,615 Kcal,2545 KJ,0.80 g,9.6 g,26 g
Queso rallado gouda Miraflores sin lactosa 150 g.,"3,25 €",29 g,357 Kcal,1495 KJ,1.8 g,0 g,24 g
Tónica Schweppes zero botella 20 cl,"1,16 €",0.0 g,2 Kcal,7 KJ,0.02 g,0.0 g,0.0 g
Snack infantil desde 10 meses guisantes y maíz ecológico Hero Solo sin gluten 40 g.,"2,39 €",2.7 g,382 Kcal,1617 KJ,0.01 g,77 g,9.3 g
"Agua mineral Font Vella Sensación con zumo de limón 1,25 l.","1,95 €",0 g,1 Kcal,5 KJ,0 g,0 g,0 g
Regaliz de goma sabor fresa Fini 200 g.,"2,25 €",2.5 g,360 Kcal,1525 KJ,0.3 g,83 g,1.3 g
"Batido de fresa Carrefour sin gluten pack de 3 brik de 200 ml,","1,34 €",0.6 g,57 Kcal,243 KJ,0.10 g,10 g,3 g
Pan rebanado hogaza 500 g,"1,99 €",2.9 g,267 Kcal,1131 KJ,1.2 g,49.0 g,9.8 g
Gel energético con ciclodextrina sabor a cereza 226 ERS 76 g.,"2,69 €",0 g,263 Kcal,1118 KJ,0.13 g,66 g,0 g
Caramelos de goma Favoritos Red&White Haribo 1 kg.,"13,19 €",4 g,359 Kcal,1522 KJ,0.05 g,78 g,3.2 g
"Refresco de naranja sin gas botella 1,5 l.","1,05 €",,2 Kcal,7 KJ,0.01 g,0.5 g,
Muesli de avena de chocolate ecológico Carrefour Bio 375 g.,"3,49 €",7.9 g,376 Kcal,1582 KJ,0.03 g,61 g,11 g
Jamón Ahumado Natural en lonchas El Charcutero sin gluten y sin lactosa bipack de 200 g,"3,19 €",4.5 g,114 Kcal,426 KJ,2.3 g,0.5 g,18.7 g
Aceite de oliva virgen extra arbequina K Argiñano 750 ml.,"12,45 €",92 g,824 Kcal,3400 KJ,0 g,0 g,0 g
Zamburiñas en salsa marinera con tomate Carrefour sin gluten 65 g.,"2,25 €",12 g,162 Kcal,674 KJ,1 g,2 g,11 g
Crema de verduras de la huerta Carrefour sin gluten 500 ml.,"0,99 €",2.2 g,43 Kcal,180 KJ,0.68 g,4.6 g,0.7 g
Lenteja categoría extra Carrefour 1 kg.,"1,88 €",2.1 g,281 Kcal,1171 KJ,0 g,23 g,23 g
Tarrito con cachitos de estrellitas con tomate desde 10 meses ecológico Smileat sin lactosa 230 g.,"2,89 €",1 g,43.3 Kcal,183.4 KJ,0.022 g,8.1 g,1.9 g
Galletas de mantequilla con limón y jengibre Campbells 125 g.,"4,15 €",25 g,489 Kcal,2082 KJ,1 g,64 g,5 g
Queso rallado en polvo El Caserio 80 g.,"1,52 €",18 g,280 Kcal,1168 KJ,6.2 g,4.2 g,22 g
Yogur liquido de piña y coco Carrefour Classic´ sin gluten 1000 g.,"1,45 €",2 g,72 Kcal,305 KJ,0.11 g,11 g,2.6 g
Fusilli de guisantes Carrefour Veggie 250 g.,"2,45 €",2.2 g,343 Kcal,1450 KJ,1.14 g,55 g,22 g
Cintas multicolor Carrefour Classic 100 g.,"0,99 €",2.3 g,369.0 Kcal,1566.0 KJ,0.23 g,82.0 g,2.3 g
Zumo de naranja Don Simón pack de 6 briks de 20 cl.,"2,95 €",0 g,43 Kcal,183 KJ,0.01 g,10 g,0.6 g
Robinsons de limón sin gas botella 1 l.,"2,49 €",0 g,9.6 Kcal,41 KJ,0.20 g,0.3 g,0.2 g
Callos a la madrileña De Nuestra Tierra 500 g,"3,95 €",7.4 g,137 Kcal,573 KJ,1 g,1.9 g,16 g
Chorizo en lonchas Carrefour Classic' sin gluten sin lactosa 80 g.,"1,75 €",27 g,351 Kcal,1458 KJ,3.40 g,2 g,25 g
"Font Vella La Limonada con zumo de limón sin gas botella 1,25 l.","1,99 €",0 g,17 Kcal,72 KJ,0 g,4.2 g,0.02 g
Cereales Crunch Weetabix 450 g.,"3,85 €",2.5 g,379 Kcal,1603 KJ,0.28 g,66 g,20 g
Crema de la huerta con verduras mediterráneas Santa Teresa sin gluten sin lactosa 400 g.,"3,09 €",2.8 g,44 Kcal,181 KJ,0.73 g,2.2 g,1.0 g
Tinto de verano limón sin alcohol Don Simón lata 33 cl.,"0,75 €",0 g,14 Kcal,60 KJ,0.01 g,3.5 g,0.1 g
Palitos de pan con crema de cacao Schär sin gluten y sin lactosa 52 g.,"2,49 €",23 g,496 Kcal,2080 KJ,0.80 g,68 g,3.7 g
Barritas Tender milk Milka 5 ud.,"3,15 €",18 g,407 Kcal,1705 KJ,0.47 g,56 g,6 g
Nata para cocinar espesa Président pack de 2 unidades de 250 ml.,"4,35 €",18 g,197 Kcal,816 KJ,0.13 g,6 g,2.8 g
Gazpacho fresco Carrefour 1 l,"3,35 €",4.2 g,51.0 Kcal,213.0 KJ,0.97 g,2.4 g,0.6 g
Solomillo de cerdo Extratiernos ElPozo 750 g aprox,"8,06 €",3 g,103 Kcal,434 KJ,1.2 g,0.5 g,18 g
Soles gorgonzola y nueces Carrefour Extra 250 g.,"2,59 €",11 g,298 Kcal,1252 KJ,1.2 g,37 g,11 g
Preparado de soja natural con avena Alpro sin lactosa 400 g.,"2,29 €",2.2 g,56.0 Kcal,233.0 KJ,0.21 g,3.3 g,3.8 g
Calamar patagónico entero congelado Classic´ Carrefour 510 g.,"4,39 €",1.4 g,87 Kcal,368 KJ,0.7 g,0.8 g,18 g
Galleta con chocolate con leche Tosta Rica Cuétara 210 g.,"2,70 €",19 g,469 Kcal,1967 KJ,0.55 g,67 g,6.2 g
Queso puro de oveja viejo graso mini Flor de Esgueva pieza de 1 kg,"26,90 €",39 g,461 Kcal,1901 KJ,2.1 g,0.5 g,24 g
Arroz con leche Dhul sin gluten sin lactosa pack de 2 unidades de 130 g.,"1,55 €",2.9 g,126 Kcal,533 KJ,0.09 g,22.0 g,3.2 g
Barrita de gominola sabor cereza y cola con cafeína y l-taurina 226ERS sin gluten 30 g.,"2,65 €",0.1 g,271 Kcal,1142 KJ,0.17 g,55.6 g,1.3 g
Galletas Creme Tropical Gullón 1 kg.,"4,09 €",18 g,473 Kcal,1985 KJ,0.70 g,70 g,6.5 g
Vodka Eristoff 1 l.,"15,59 €",0.0 g,208.0 Kcal,872.0 KJ,0.0 g,0.0 g,0.0 g
Café molido natural Lavazza Qualità Rossa 250 g.,"4,75 €",11.6 g,329.0 Kcal,1356.0 KJ,0.01 g,10.2 g,18.3 g
Cerveza San Miguel especial Lager pack de 12 botellas de 25 cl.,"5,39 €",0 g,49 Kcal,204 KJ,0 g,4.1 g,0.4 g
Bacon en lonchas Oscar Mayer sin gluten 150 g.,"2,29 €",36 g,386 Kcal,1594 KJ,2.8 g,1.4 g,14 g
Filetes de anchoa del Cantábrico en aceite de oliva De Nuestra Tierra 53 g.,"3,85 €",6.1 g,173 Kcal,727 KJ,8.3 g,0 g,30 g
Café latte proteína sin azúcar añadido Mr. Big Kaiku sin gluten sin lactosa 370 ml.,"2,69 €",1.1 g,55 Kcal,233 KJ,0.07 g,3.7 g,7.7 g
Pincho Moruno de Cerdo Amarillo Carrefour El Mercado 340 g,"3,39 €",1.5 g,92 Kcal,391 KJ,1.68 g,1.3 g,18 g
Hamburguesa de añojo Círculo de Calidad 300 g,"3,79 €",3.9 g,118 Kcal,498 KJ,1 g,0.5 g,20.3 g
Queso mozzarella fresca Toscanella Asturiana 100 g.,"1,61 €",15 g,203 Kcal,844 KJ,1 g,1 g,16 g
Crackers Schär sin gluten y sin lactosa 210 g.,"4,29 €",12 g,446 Kcal,1878 KJ,1.6 g,79 g,3.3 g
Chocolate blanco fondant 100 g.,"0,69 €",30 g,534 Kcal,2232 KJ,0.26 g,59 g,7 g
Sandwich Choco Brownie Maxibon 4 ud.,"6,25 €",16 g,308 Kcal,1290 KJ,0.37 g,36 g,4.2 g
"Queso de untar light Classic´ Carrefour 300 g,","1,29 €",11 g,141 Kcal,587 KJ,0.65 g,3.0 g,6.9 g
Caramelos Marshmallo Little Becky 280 g.,"3,89 €",0 g,329 Kcal,1399 KJ,0.1 g,80 g,2.3 g
Noodles sabor pollo Carrefour 85 g.,"1,13 €",19 g,459 Kcal,1921.74 KJ,3.5 g,62 g,11 g
