name,price,grasa,calorias,kJ,sal,carbohidratos,proteinas
Timbal de verduras en aceite Extra Carrefour 90 g.,"2,25 €",40 g,420 Kcal,1735 KJ,0.89 g,12 g,1.3 g
Aceitunas verdes rellenas de anchoa sabor suave La Española sin gluten 130 g.,"2,59 €",15.4 g,154.6 Kcal,635.7 KJ,1.9 g,0.1 g,1.8 g
Boquerón limpio congelado Carrefour 500 g.,"4,85 €",0 g,83 Kcal,352 KJ,0.4 g,1.7 g,17 g
Atún claro sin aceite al natural Calvo pack de 3 latas de 56 g.,"3,59 €",0.6 g,84 Kcal,351 KJ,1.5 g,0 g,20 g
Yogur de arándanos ecológico Pastoret 135 g.,"2,15 €",3.3 g,111 Kcal,468 KJ,0.1 g,14.7 g,4.9 g
Bebida de coco sin azúcar Alpro sin gluten y sin lactosa brik 1 l.,"2,29 €",1.2 g,14 Kcal,56 KJ,0.07 g,0 g,0.1 g
Nestea té negro con limón bajo en calorías botella 50 cl.,"1,68 €",0 g,19.0 Kcal,80.0 KJ,0.03 g,4.5 g,0 g
Chocolate con leche Valor sin gluten 300 g.,"3,69 €",31.5 g,537 Kcal,2242 KJ,0.35 g,54.6 g,7.3 g
Choco Roll Classic' Carrefour 270 g.,"1,72 €",20.0 g,444.0 Kcal,1860.0 KJ,0 g,61.0 g,4.0 g
Patatas fritas tatas La Madrileña 280 g.,"1,99 €",34.3 g,545.0 Kcal,2278.1 KJ,1.4 g,50.4 g,6.4 g
Wraps durum tortillas de trigo Mission sin aceite de palma 6 ud.,"2,09 €",7.54 g,321 Kcal,1355 KJ,1.6 g,53 g,8.3 g
Cacahuetes recubiertos de chocolate Zero Prozis 40 g.,"1,27 €",36 g,515.75 Kcal,2158 KJ,0.16 g,44 g,12 g
Bolsita de plátano y manzana desde 4 meses Nestlé sin gluten y sin azúcar añadido 90 g.,"1,25 €",0.2 g,76.0 Kcal,321.0 KJ,0.01 g,16.8 g,0.7 g
Bizcocho macaron de mousse de nueces y almendras Extra Carrefour 410 g.,"7,05 €",24 g,449 Kcal,1877 KJ,0.16 g,48 g,8.6 g
Leche entera Pascual sin lactosa brik 1 l.,"1,52 €",3.6 g,64 Kcal,266 KJ,0.12 g,4.6 g,3.2 g
Crema de cacao con leche y avellanas Carrefour sin gluten 750 g.,"2,96 €",31 g,543 Kcal,2269 KJ,0.11 g,61 g,4.2 g
Tortitas de maíz receta mediterránea Bicentury 70 g.,"1,73 €",17.0 g,473.0 Kcal,1990.0 KJ,2.2 g,72.0 g,7.3 g
Helado de fresa Carrefour Extra sin gluten sin lactosa 480 g.,"4,45 €",8.6 g,170 Kcal,710 KJ,0.12 g,21 g,2 g
Aperitivo de maíz sabor sal ahumada y pimienta negra Risi Mios! sin gluten 95 g.,"1,50 €",19.5 g,478.0 Kcal,2006.0 KJ,0.61 g,62.0 g,11.0 g
Lasaña de atún Carrefour 500 g.,"2,89 €",4 g,126 Kcal,530 KJ,0.75 g,15 g,6.4 g
Bacon ahumado en lonchas El Pozo pack de 2 unidades de 180 g envase de 360 g,"5,29 €",22.5 g,262.5 Kcal,1087 KJ,2.2 g,1 g,14 g
Tiras de pechuga de pollo estilo americano Recetas Crujientes La Cocinera 350 g.,"6,99 €",7.8 g,192 Kcal,807 KJ,0.75 g,12 g,18 g
Wraps tortillas de trigo Carrefour Sensation sin aceite de palma 6 ud.,"1,65 €",7.5 g,321 Kcal,1355 KJ,1.6 g,53 g,8.3 g
Aceite de oliva virgen extra Nuñez de Prado 500 ml.,"11,89 €",100 g,900 Kcal,3700 KJ,0 g,0 g,0 g
Kétchup clásico Prima sin gluten envase 730 g.,"3,95 €",0 g,82 Kcal,344 KJ,2 g,19 g,1.4 g
"Carrefour Isofresh blue botella 1,5 l.","1,55 €",0 g,20 Kcal,83 KJ,0.08 g,4.9 g,0 g
Pintxo a la donostiarra con gambas Aguinamar 200 g,"3,45 €",20 g,224 Kcal,925 KJ,1.5 g,5.6 g,5.3 g
Yogur natural de leche de oveja pasteurizada ecológica Carrefour Bio 420 g.,"3,45 €",6 g,90 Kcal,373 KJ,0 g,4 g,5 g
"Queso fresco desnatado de Burgos Carrefour pack de 4 unidades de 62,5 g.","1,05 €",0.5 g,60 Kcal,255 KJ,0.83 g,4 g,11 g
"N?CT S/AZ NJA DISF. DSIMON 1,5","2,45 €",0 g,25 Kcal,104 KJ,0.01 g,5.7 g,0.3 g
Lasaña de Atún La Cocinera 500 g.,"5,15 €",6.9 g,148 Kcal,621 KJ,0.83 g,15 g,6.2 g
Perlitas de chocolate Vahiné 100 g.,"2,85 €",28 g,511 Kcal,2136 KJ,0.01 g,54.3 g,6 g
Pan de molde elaborado con harina integral 14 % sin corteza de trigo espelta ecológico Artebianca sin lactosa 300 g.,"4,49 €",4.4 g,275 Kcal,1162 KJ,1.5 g,47.7 g,9.6 g
Menestra de verduras Findus 1 kg.,"4,49 €",0 g,45 Kcal,189 KJ,0.22 g,6.2 g,3.0 g
Cacao instantáneo Chococao Carrefour sin gluten 500 g.,"2,49 €",2.6 g,378 Kcal,1598 KJ,0.22 g,81 g,4.6 g
Baguette Carrefour Classic' sin gluten sin lactosa 175 g.,"2,09 €",9.7 g,261 Kcal,1093 KJ,1.71 g,37.1 g,1.8 g
Caramelo con palo Mini Chupa Chups sin gluten 20 ud.,"2,79 €",0 g,388 Kcal,1647 KJ,0.07 g,96 g,0 g
Salchichón Ibérico Extra en lonchas Carrefour sin gluten 100 g,"1,29 €",38.7 g,446.0 Kcal,1845.0 KJ,3.4 g,1.9 g,22.4 g
Leche fermentada líquida desnatada de fresa Danone Vitalinea Densia pack de 4 unidades de 100 g.,"2,35 €",0.4 g,50.0 Kcal,209.0 KJ,0.13 g,7.9 g,3.2 g
Langostino crudo Carrefour 800 g.,"8,79 €",0.99 g,102.0 Kcal,433.0 KJ,2.5 g,1.0 g,22.3 g
Avellanas tostadas sin sal añadida ecológicas Carrefour Bio 90 g.,"2,85 €",65 g,695 Kcal,2871 KJ,0.03 g,6.8 g,18 g
Aceite de oliva virgen extra hojiblanca Carbonell 1 l.,"15,99 €",100 g,900 Kcal,3700 KJ,0 g,0 g,0 g
Hueva de atún aleta amarilla Carrefour El Mercado 160 g,"7,95 €",12 g,288 Kcal,1210 KJ,6.2 g,0.7 g,44 g
Berlinas de azúcar Carrefour 4 ud,"1,35 €",22 g,393 Kcal,1641 KJ,1.3 g,40 g,7.6 g
Queso tierno y cremoso en lonchas El Ventero 160 g.,"3,65 €",32 g,374 Kcal,1549 KJ,1.3 g,1 g,20 g
Palomitas con sal Classic Carrefour sin gluten 80 g.,"1,13 €",25.0 g,517.0 Kcal,2163.0 KJ,1.9 g,59.0 g,9.7 g
Preparado de soja para cocinar ecológico Carrefour Bio 250 ml.,"2,25 €",17 g,177 Kcal,732 KJ,0 g,3 g,3 g
Caramelos de goma Starmix Haribo 1 kg.,"11,09 €",0.5 g,339 Kcal,1439 KJ,0.01 g,78 g,5.9 g
Vino blanco Elegido 1 l.,"1,99 €",0.1 g,65 Kcal,269 KJ,0.006 g,1.9 g,0.1 g
Salsa hoisin para pato Tiger Khan 300 ml.,"3,55 €",1.5 g,200 Kcal,837 KJ,5.9 g,44 g,2 g
Batido de proteína sabor fresa y vainilla sin azúcar añadido Kaiku sin gluten sin lactosa 330 ml.,"2,59 €",0.5 g,61 Kcal,260 KJ,0.14 g,4.6 g,9.1 g
Judión cocido categoría extra Carrefour 400 g.,"1,65 €",0.8 g,101 Kcal,425 KJ,0.59 g,15 g,5.4 g
Galletas con sésamo Gerblé 230 g.,"2,79 €",22 g,483 Kcal,2026 KJ,0.61 g,58 g,11 g
Crema de queso con finas hierbas Arla 200 g.,"1,95 €",16.0 g,189.0 Kcal,784.0 KJ,1.2 g,4.1 g,7.7 g
Anchoas en aceite de oliva Carrefour 55 g.,"2,65 €",7.7 g,186 Kcal,785 KJ,10.3 g,0 g,29 g
Galletas de barquillo rellenas sabor nata Carrefour 210 g.,"0,99 €",30 g,536 Kcal,2240 KJ,0.28 g,62 g,4.0 g
Bombay Sapphire Sunset Ginebra,"25,50 €",0 g,239 Kcal,1000 KJ,0 g,0 g,0 g
Pipas gigantes aguasal Classic Carrefour 400 g.,"2,35 €",52 g,631 Kcal,2612 KJ,0.03 g,5.7 g,30 g
Rollitos de maíz sabor queso picante Takis Eagle 140 g.,"2,35 €",29 g,538 Kcal,2249 KJ,1.9 g,60 g,6.3 g
Pudding sabor a cacahuete proteína plus Carrefour Sensation sin gluten y sin azúcar añadido 200 g.,"1,41 €",1.5 g,74 Kcal,312 KJ,0.21 g,5.1 g,10 g
"Preparado 7 frutas desde 6 meses Nestlé sin gluten, sin lactosa y sin azúcar añadido pack de 4 unidades de 100 g.","3,09 €",0.2 g,61 Kcal,259 KJ,0.02 g,13.4 g,0.5 g
Hamburguesa de pollo y zanahoria 240 g,"2,15 €",10 g,168 Kcal,701 KJ,1.9 g,5.2 g,13 g
Tarta helada al whisky Nestlé Helados 580 g.,"10,65 €",11.1 g,236 Kcal,987 KJ,0.21 g,28.5 g,2.9 g
Galletas rellenas de crema de chocolate Maxi Choc Príncipe 250 g.,"2,55 €",24 g,507 Kcal,2121 KJ,0.4 g,65 g,5.5 g
Salchichas de queso Oscar Mayers Jumbo sin gluten 350 g.,"2,65 €",19 g,233 Kcal,967 KJ,2 g,1.5 g,14 g
Tomate frito Carrefour pack de 3 briks de 215 g.,"1,12 €",3.5 g,73 Kcal,304 KJ,0.9 g,8.9 g,1.2 g
Pan de molde blanco mediano Warburtons 800 g.,"5,05 €",2 g,244 Kcal,1025 KJ,,46.4 g,9.1 g
Caldo de pollo en pastillas Original Carrefour 12 pastillas,"0,78 €",0.5 g,4.0 Kcal,17.0 KJ,0.96 g,0.6 g,0.5 g
Chocolate negro 70% cacao con naranja Suchard 100 g.,"2,99 €",46 g,594 Kcal,2461 KJ,0.02 g,33 g,6.7 g
Chorizo casero extra sarta Palacios 250 g.,"3,59 €",43 g,489 Kcal,2027 KJ,3.6 g,0.7 g,26 g
Brócoli sin sal añadida Classic Carrefour 370 g.,"2,45 €",0.0 g,15.0 Kcal,65.0 KJ,0.02 g,1.6 g,1.4 g
Postre lácteo de proteínas sabor caramel macchiato Danone Yopro pack de 2 unidades de 160 g.,"2,69 €",0.1 g,55 Kcal,230 KJ,0.1 g,4.1 g,9.4 g
"Arroz tres delicias tortilla, surimi y cerdo 1 kg.","2,55 €",1.4 g,107.0 Kcal,451.0 KJ,0.35 g,19.0 g,3.7 g
Verduras para pisto ultracongelado Classic' Carrefour 450 g.,"2,59 €",10.0 g,99.0 Kcal,412.0 KJ,0.02 g,3.7 g,2.8 g
"Jurelitos aliñados con aceite de oliva, ajo y perejil Bogamar 100 g","3,99 €",1.5 g,47.8 Kcal,200 KJ,3.3 g,0.56 g,17.9 g
Butifarra catalana pieza Avia 300 g aprox,"4,17 €",13 g,197 Kcal,818 KJ,2.1 g,4.03 g,13.4 g
Pan tostado Schär sin gluten y sin lactosa 260 g.,"5,59 €",6.3 g,393 Kcal,1656 KJ,1.8 g,76 g,3.9 g
Leche fermentada líquida con fresa Danone - Actimel sin gluten pack de 6 unidades de 100 g.,"3,79 €",1.5 g,77.0 Kcal,324.0 KJ,0.1 g,12.0 g,2.9 g
Pizza de mozzarella Carrefour 340 g.,"2,06 €",12 g,252 Kcal,1054 KJ,1.1 g,23 g,11 g
Empanada gourmet de carne Carrefour 1 kg,"9,99 €",7.8 g,216 Kcal,906 KJ,1.43 g,24.63 g,10.6 g
Queso brie 60% M.G Carrefour 200 g,"1,60 €",32 g,358 Kcal,1482 KJ,1.2 g,0 g,17 g
Filetes de anchoa en aceite de oliva De Nuestra Tierra 100 g.,"6,75 €",9.72 g,192.36 Kcal,805.37 KJ,9.52 g,1.0 g,26.22 g
Chorizo picante Revilla sin gluten 250 g.,"4,40 €",33 g,403 Kcal,1673 KJ,4 g,0.6 g,26 g
Crema con avellanas un sabor Dulcinea 700 g.,"2,75 €",31 g,541 Kcal,2260 KJ,0.2 g,63 g,2 g
Salsa basílico Barilla sin gluten y sin lactosa tarro 400 g.,"3,69 €",2.6 g,64.0 Kcal,268.0 KJ,,7.6 g,1.6 g
Fettuccine al huevo Gallo 450 g.,"1,70 €",2 g,344 Kcal,1458 KJ,0.03 g,66 g,14 g
Queso mozzarella Italiana Carrefour 125 g.,"0,95 €",18 g,235 Kcal,983.9 KJ,0.7 g,1.3 g,17 g
Copos de cereales chocolateados  Carrefour Kids 500 g.,"1,75 €",3.2 g,385.0 Kcal,1628.0 KJ,0.23 g,76.0 g,9.5 g
"Barritas de cereales con chocolate negro sin azúcar añadido Bicentury Sarialís sin gluten pack de 6 unidades de 14,5 g.","3,39 €",26 g,438 Kcal,1820 KJ,0.33 g,55 g,5.5 g
Viñas Del Vero Col. Gewürztraminer Gewurtztraminer 2022,"12,79 €",0 g,76 Kcal,317 KJ,0 g,1.15 g,0 g
Croissants integrales Dulcesol 270 g.,"2,29 €",21 g,377 Kcal,1573 KJ,1.2 g,38 g,8.5 g
Nachos con sal Mexifoods sin gluten y sin aceite de palma 200 g.,"2,89 €",26 g,500 Kcal,2090 KJ,1 g,56 g,6 g
Postre lácteo fresa desde 8 meses Nestlé Yogolino sin gluten pack de 8 unidades de 100 g.,"5,59 €",2.6 g,84.0 Kcal,352.0 KJ,0.08 g,11.8 g,3.0 g
Queso tierno en lonchas Carrefour 200 g.,"2,19 €",25 g,325 Kcal,1350 KJ,1.8 g,1 g,24 g
Copos de avena integral suaves Kölln 500 g.,"2,85 €",6.7 g,361.0 Kcal,1520.0 KJ,0.01 g,55.8 g,13.8 g
Bonito del norte en aceite de oliva Consorcio 260 g.,"10,19 €",10 g,202 Kcal,846 KJ,1 g,0 g,28 g
Aperitivo de maíz X-Hot Risketos sin gluten 135 g.,"1,60 €",36.0 g,567.0 Kcal,2366.0 KJ,0.7 g,55.4 g,4.6 g
Arroz redondo Brillante Sabroz 1 kg.,"2,69 €",1.20 g,342 Kcal,1452 KJ,0.10 g,74 g,6.80 g
Guacamole Carrefour 500 g,"3,59 €",14.1 g,156 Kcal,644 KJ,1.3 g,3.7 g,2.3 g
Sardinillas en aceite de girasol picantes Cabo de Peñas 60 g.,"1,65 €",6.3 g,122 Kcal,509 KJ,1.20 g,0.8 g,15.4 g
Lenteja categoría extra ecológica Luengo 500 g.,"3,45 €",2.1 g,281 Kcal,1171 KJ,0 g,23 g,23 g
Snacks de cereales con frambuesa desde 8 meses ecológico Gerber sin azúcar añadido 35 g.,"2,49 €",8.6 g,421 Kcal,1757 KJ,0.10 g,76.0 g,7.9 g
Croquetas de espinacas Carrefour Extra 350 g.,"1,99 €",7.7 g,185 Kcal,775 KJ,1 g,24 g,3.1 g
Cono Extreme Caramel Choco Toffee Nestlé 6 ud.,"5,65 €",12 g,293 Kcal,1231 KJ,0.28 g,43 g,3.4 g
Arroz thaï Sensation Carrefour 1 kg.,"2,59 €",0.8 g,355 Kcal,1506 KJ,0.026 g,79 g,7 g
Cocktail de frutos secos sabores del mundo África MisterCorn Grefusa 195 g.,"2,65 €",31 g,527 Kcal,2208 KJ,1.5 g,48.0 g,11 g
Leche fermentada desnatada natural Kaiku sin lactosa pack de 4 unidades de 125 g.,"2,39 €",0.1 g,35 Kcal,148 KJ,0.13 g,4.3 g,4.1 g
Panecillos con tomate y orégano Carrefour Sensation 160 g.,"1,17 €",23 g,485 Kcal,2031 KJ,0.98 g,60 g,8.1 g
Papilla infantil desde los 5 meses  8 Cereales Damira sin lactosa 600 g,"8,75 €",1.3 g,378 Kcal,1602 KJ,0.06 g,81.5 g,8.5 g
Leche infantil de continuación de 6 a 12 meses Puleva Peques 2 brik 1 l.,"1,95 €",3.0 g,64 Kcal,268 KJ,,8.0 g,1.3 g
Pan tostado 85% integral sésamo y lino Recondo sin sal y sin azúcar añadido 540 g.,"3,95 €",6.8 g,385 Kcal,1623 KJ,0.02 g,59 g,16 g
Zumo de granada y uva Carrefour brik 1 l.,"2,39 €",0.01 g,60.0 Kcal,254.0 KJ,0.03 g,14.6 g,0.32 g
Café caramelo macchiato Starbucks 750 ml.,"5,09 €",1.6 g,63.0 Kcal,264.0 KJ,0.10 g,9.0 g,2.9 g
Queso de oveja en lonchas García Baquero 125 g.,"3,59 €",37 g,442.2 Kcal,1833.1 KJ,1.8 g,1.3 g,26 g
Masa para empanada rectangular Buitoni 280 g.,"3,19 €",20.1 g,387 Kcal,1619 KJ,1.1 g,41.5 g,6.3 g
"Cerveza San Miguel 0,0 alcohol pack de 6 botellas de 25 cl.","2,99 €",0 g,24 Kcal,102 KJ,0.01 g,5.6 g,0.3 g
Coca Cola zero azúcar pack 12 latas 33 cl.,"10,44 €",0 g,0.2 Kcal,0.9 KJ,0.02 g,0 g,0 g
Palitos de galleta María Quely 50 g.,"0,75 €",10 g,435 Kcal,1837 KJ,0.93 g,77 g,8.0 g
Crema de cacahuete crujiente Sun-Pat 200 g.,"3,75 €",48.7 g,611.0 Kcal,2530.0 KJ,,14.5 g,24.8 g
Queso rallado emmental Especial pastas Président 150 g.,"2,99 €",29 g,373 Kcal,1549 KJ,0.83 g,1.0 g,27 g
Pipas con sal Grefusa 175 g.,"2,15 €",22.0 g,263.0 Kcal,1089.0 KJ,10.0 g,1.4 g,13.0 g
Zumo multifrutas exprimido Carrefour brik de 1 l.,"1,58 €",0.8 g,57 Kcal,238.65 KJ,0 g,12 g,0.5 g
Chicles de menta sin azúcar Orbit pack de 4 paquetes de 14 g.,"3,69 €",0 g,149.0 Kcal,622.0 KJ,0 g,62.0 g,0 g
Infusión sabor naranja en bolsitas Piernas Ligeras Susarón 10 ud.,"2,15 €",0 g,1 Kcal,3 KJ,0 g,0.2 g,0 g
Pan de molde integral rebanada estilo artesano con espelta y toque de miel Bimbo 550 g.,"3,39 €",2.2 g,243 Kcal,1025 KJ,1.1 g,41 g,10 g
Fideos orientales de pollo Yatekomo Yakisoba Gallina Blanca pack de 2 unidades de 93 g.,"4,15 €",10 g,224 Kcal,938 KJ,1.2 g,28 g,4.7 g
Lote Especial de Embutidos Ibéricos: Lomo de Cebo Ibérico 50% Raza Ibérica Villar sin gluten pieza de 275 g + Chorizo Ibérico Cular Villar sin gluten pieza de 275 g + Salchichón Ibérico Cular Villar sin gluten pieza de 275 g Villar,"19,90 €",36 g,427 Kcal,1771 KJ,3.2 g,0.8 g,25 g
Salpicón de marisco congelado Extra Carrefour 330 g.,"4,39 €",2 g,68 Kcal,285 KJ,0.57 g,4.4 g,7.8 g
Capuccino Carrefour Original pack de 2 unidades de 80 g.,"1,43 €",8.9 g,278 Kcal,1168 KJ,0.18 g,42.0 g,4.8 g
Barrita de chocolate salado alta en proteínas Vegan Weider 35 g.,"1,66 €",29.0 g,519.0 Kcal,2171.0 KJ,0.41 g,33.0 g,30.0 g
Tomate frito Orlando sin gluten brik 350 g.,"1,07 €",3.5 g,73.0 Kcal,307.0 KJ,1.5 g,9.1 g,1.1 g
Leche condensada de coco ecológica Naturgreen 210 g.,"3,99 €",31.0 g,478.0 Kcal,1992.0 KJ,0.2 g,47.0 g,2.7 g
Magro de cerdo cocido Iberitos lata de 200 g.,"2,79 €",21.5 g,249 Kcal,1042 KJ,2.96 g,2.91 g,12.2 g
Kombucha jengibre y limón ecológico Komvida sin gluten 75 cl.,"7,29 €",0.52 g,12 Kcal,48 KJ,0.013 g,1.65 g,0.10 g
Leche condensada Nestlé La Lechera 370 g.,"2,75 €",8.0 g,321 Kcal,1356 KJ,0.20 g,54.9 g,7.5 g
Pisto fritada de verduras Hida 350 g.,"2,19 €",5.0 g,92 Kcal,391 KJ,0.3 g,10.8 g,1.3 g
Aceite de oliva virgen extra ecológico Coosur 1 l.,"15,49 €",91.4 g,822 Kcal,3378 KJ,0 g,0 g,0 g
Margarina Carrefour 500 g.,"1,45 €",60 g,544 Kcal,2237 KJ,0.4 g,0.5 g,0.5 g
Tortita de pollo y quesos fundidos Aldelís 270 g.,"2,95 €",7.6 g,231.0 Kcal,972.0 KJ,2.01 g,25.6 g,14.5 g
Cereales con chocolate y nueces Krave Kellogg's 600 g.,"5,49 €",16 g,456 Kcal,1915 KJ,0.94 g,69 g,7.1 g
Pan Ciabatta con semillas Proceli sin gluten y sin lactosa 120 g.,"2,25 €",5.3 g,258.0 Kcal,1087.0 KJ,0.99 g,46.0 g,3.1 g
Helado de chocolate con leche con salsa de chocolate y trocitos de brownie Carte d'Or 825 ml.,"5,59 €",3.6 g,109 Kcal,456 KJ,0.06 g,17 g,1.8 g
Galletas finas de avena recubiertas de chocolate con leche sin azúcar añadido Zero Gullón 150 g.,"2,49 €",26 g,467 Kcal,1942 KJ,0.68 g,55 g,7.7 g
Barquillos de chocolate con leche Extra Carrefour 125 g.,"1,34 €",29 g,534 Kcal,2230 KJ,0.47 g,60 g,5.9 g
Chocolate negro intenso con limón Lindt Excellence 100 g.,"3,25 €",31 g,519 Kcal,2161 KJ,0.09 g,50 g,5 g
Conos con helado de chocolate Cornetto 6 ud.,"5,59 €",18 g,316 Kcal,1319 KJ,0.17 g,33 g,4 g
Tortellini de queso Gallo 500 g.,"2,95 €",9 g,387 Kcal,1632 KJ,2.4 g,62 g,13 g
La Casera hierbabuena 0% azucares y calorías lata 33 cl.,"0,62 €",0.0 g,1 Kcal,6 KJ,0.02 g,0.1 g,0.0 g
Bebida de almendras Almendrola sin gluten brik 1 l.,"2,15 €",1.8 g,39.0 Kcal,164.0 KJ,0.04 g,4.8 g,0.8 g
Pintxo de marisco Aguinamar 200 g,"3,45 €",8.5 g,200 Kcal,531 KJ,1.8 g,6.2 g,7.1 g
Bebida de avena ecológica EcoCesta sin azúcar añadido brik 1 l.,"2,45 €",1 g,51 Kcal,215 KJ,0.08 g,9 g,1 g
Postre de amaretto y caramelo salado Senza Peccato sin gluten 110 g.,"2,49 €",11 g,268 Kcal,1233 KJ,0.49 g,40 g,2 g
Cacahuetes fritos sin sal añadida Classic Carrefour 200 g.,"1,25 €",51 g,622 Kcal,2574 KJ,0.04 g,9.7 g,27 g
Cerveza tostada Cruzcampo 0.0 alcohol gran reserva lata 33 cl.,"0,85 €",0 g,21 Kcal,91 KJ,0.01 g,4.7 g,0.6 g
Hamburguesa de picaña Angus de vacuno Carrefour Selección Lord Dani 300 g,"4,65 €",12 g,190 Kcal,791 KJ,1.4 g,0 g,20 g
Profiteroles al cacao Carrefour Original pack de 2 unidades de 80 g.,"1,43 €",12.0 g,299 Kcal,1253 KJ,0.3 g,41.0 g,5.5 g
Chipirones rellenos al ajillo Dani 96 g.,"3,25 €",7 g,140 Kcal,580 KJ,1 g,0 g,19 g
Arroz 3 delicias Carretilla sin gluten sin aceite de palma 250 g.,"3,25 €",6.1 g,156 Kcal,654 KJ,1.47 g,20.0 g,4.7 g
Gamba pelada cruda congelada Grand Krust 300 g.,"9,19 €",0.400 g,51 Kcal,217 KJ,4 g,0.500 g,11.30 g
Masa para empanadillas y postres Buitoni 280 g.,"2,05 €",13.2 g,342 Kcal,1435 KJ,1.8 g,48.1 g,6.8 g
queso tierno El Cigarral 960 g,"20,70 €",33.00 g,400 Kcal,1657 KJ,1.60 g,2.10 g,23.00 g
"Queso semicurado mezcla Tierra de Tradición pieza 1,1 kg.","12,89 €",34 g,414 Kcal,1715 KJ,1.75 g,1.0 g,27 g
Pollo asado al horno relleno en lonchas La Carloteña sin gluten 150 g,"2,25 €",5 g,130 Kcal,547 KJ,2 g,2 g,18 g
Bombón helado de chocolate blanco Simpl 6 ud.,"2,45 €",16 g,285 Kcal,1191 KJ,0.21 g,33 g,2.4 g
Yogur con fresas Danone Original pack de 2 unidades de 130 g.,"1,95 €",2.8 g,108 Kcal,454 KJ,0.12 g,18.3 g,2.5 g
Salsa mexicana picante Sensation Carrefour 300 g.,"1,25 €",0.5 g,36 Kcal,149 KJ,1.8 g,5 g,1.5 g
Tortitas de maíz sabor jamón ibérico Bicentury 70 g.,"1,73 €",15 g,458 Kcal,1925 KJ,3.1 g,72 g,7.9 g
"Infusión de maca con jengibre, canela y naranja en bolsitas Hornimans 20 ud.","2,95 €",0 g,1 Kcal,4 KJ,0 g,0.2 g,0 g
Crema al vinagre balsámico de módena Borges 210 ml.,"3,29 €",0 g,173 Kcal,731 KJ,0.08 g,41 g,0.2 g
Cono de golosinas Fini 70 g.,"1,53 €",0.0 g,344.0 Kcal,1462.0 KJ,0.1 g,86.0 g,0.0 g
Salsa arrabbiata Barilla tarro 400 g.,"3,69 €",3.1 g,64.0 Kcal,268.0 KJ,,6.9 g,1.4 g
Leche infantil para lactantes desde el primer día en polvo Nutribén Innova TOProtein 1 sin aceite de palma lata 800 g.,"28,80 €",25.6 g,489.0 Kcal,2046.0 KJ,,54.6 g,9.4 g
Anarcado ecológico Paño Naturae sin gluten 110 g.,"1,99 €",49 g,621 Kcal,2576 KJ,0 g,21 g,22 g
"Gaseosa La Casera cero calorías pack de 4 botellas de 1,5 l.","4,69 €",0.0 g,0.3 Kcal,1.1 KJ,0.1 g,0.0 g,0.0 g
Galletas Dibus Angry Birds Gullón sin lactosa 250 g.,"2,29 €",16 g,451 Kcal,1892 KJ,0.83 g,67 g,6.1 g
Tónica Schweppes lata 25 cl.,"0,85 €",0.0 g,11 Kcal,48 KJ,0.02 g,2.4 g,0.0 g
Snack sabor jamón Papa Delta Grefusa 135 g.,"3,05 €",25 g,493.0 Kcal,2060.0 KJ,2.3 g,60.0 g,3.9 g
Mousse de chocolate con leche Extra Carrefour sin gluten 280 g.,"3,89 €",30 g,411 Kcal,1709 KJ,0.16 g,28 g,7.1 g
Regaliz de goma sabor fresa Balla Stixx Haribo 200 g.,"2,29 €",3.6 g,370 Kcal,1569 KJ,0.04 g,81 g,2.6 g
Bombón helado sabor vainilla con chocolate con leche y almendras Carrefour 6 ud.,"2,45 €",22 g,332 Kcal,1384 KJ,0.15 g,29 g,4.1 g
Harina de almendras Borges 200 g.,"3,19 €",55.0 g,626.0 Kcal,2585.0 KJ,0.03 g,4.2 g,23.0 g
Bonito del norte en escabeche Carrefour 72 g.,"1,79 €",7 g,142 Kcal,594 KJ,1.2 g,0.5 g,20 g
Atún claro en aceite de oliva bajo en sal Calvo pack de 3 latas de 65 g.,"4,69 €",21 g,278 Kcal,1157 KJ,0 g,0 g,21 g
Cerveza El Alcázar botella 33 cl.,"1,20 €",0 g,52 Kcal,218 KJ,0.01 g,4.2 g,0.5 g
"Tabla surtido de foie gras: pato, oca, pato con trufa y pato con boletus Martiko pack de 4 unidades de 20 g","7,75 €",43 g,424 Kcal,1746 KJ,0.85 g,3.6 g,5.6 g
Galletas Yayitas Desayuno Lu 600 g.,"4,35 €",17 g,477 Kcal,2003 KJ,0.61 g,72 g,7.4 g
Aderezo de limón exprimido Carrefour 250 ml.,"0,89 €",0.1 g,12.8 Kcal,53.55 KJ,0.004 g,2.5 g,0.44 g
Salchichón cular extra España e Hijos sin gluten pieza de 400 g,"6,00 €",26 g,352 Kcal,1465 KJ,4.2 g,1.5 g,27 g
Filetes de sardina aliñada con ajo y perejil 140 g,"4,29 €",18 g,238 Kcal,992 KJ,6 g,0.25 g,22.7 g
"Refresco Carrefour sabor fresa con gas botella 1,5 l.","1,24 €",0 g,22 Kcal,95 KJ,0.03 g,5.3 g,0 g
Harina de trigo ecológica Gallo 800 g.,"2,25 €",1.7 g,349 Kcal,1480 KJ,0.4 g,71 g,11 g
Hummus con pimiento del piquillo asado Carrefour Extra sin gluten 240 g,"1,45 €",12 g,193 Kcal,801 KJ,,11 g,7.2 g
Preparado lácteo con nueces Omega 3 Puleva sin gluten brik 1 l.,"1,95 €",2.3 g,51 Kcal,214 KJ,0.10 g,4.8 g,2.8 g
Masa para pizza rectangular Maxi Buitoni 350 g.,"3,09 €",5.5 g,280 Kcal,1183 KJ,1.5 g,46.3 g,8.6 g
Sobaos mini Classic' Carrefour 340 g.,"1,35 €",25.0 g,450.0 Kcal,1879.0 KJ,0.88 g,50.0 g,5.5 g
Kétchup Heinz envase 220 ml.,"2,55 €",0.1 g,103 Kcal,440 KJ,0.9 g,24.1 g,0.9 g
Mini galletas The Simpsons Crunchy Arluy 400 g.,"4,19 €",17 g,467 Kcal,1955 KJ,0.68 g,72 g,5.2 g
Salmón ahumado noruego Extra Carrefour 100 g.,"3,79 €",13 g,212 Kcal,886 KJ,3.2 g,0.8 g,23 g
Tinto de verano con limón sin alcohol La Casera lata 33 cl.,"0,99 €",0.0 g,18 Kcal,78 KJ,0.10 g,4.1 g,0.1 g
Filetes de anchoa del Cantábrico en aceite de oliva Cuca 29 g.,"4,19 €",9.7 g,191 Kcal,800 KJ,9.3 g,0 g,29 g
Garbanzos a la riojana Original Carrefour sin gluten 420 g.,"1,35 €",6.4 g,129 Kcal,539 KJ,0.8 g,10.8 g,5.8 g
Aceitunas manzanilla gazpachas Fragata sin gluten 400 g.,"4,45 €",15.0 g,146.0 Kcal,599.0 KJ,4.0 g,0.1 g,0.9 g
Red Bull Bebida Energética Zero lata 25 cl,"1,59 €",0 g,2 Kcal,9 KJ,0.02 g,0 g,0 g
Preparado para pan Schär sin gluten y sin lactosa 1 kg.,"5,09 €",0.9 g,348 Kcal,1475 KJ,0.83 g,80 g,2.7 g
Queso de mezcla tostado en cuña Gran Capitán 200 g,"4,89 €",39 g,157 Kcal,1893 KJ,2 g,1.1 g,26 g
Salsa picante Piri Piri Sensation Carrefour botella 200 g.,"0,99 €",1.4 g,30 Kcal,125 KJ,1.5 g,2.7 g,0.9 g
Mantequilla con sal Carrefour 250 g.,"1,90 €",82 g,743 Kcal,1056 KJ,1.3 g,0.7 g,0.6 g
Bombón helado chocolate con leche 6 ud.,"2,45 €",16 g,284 Kcal,1187 KJ,0.18 g,32 g,2.6 g
Azúcar moreno de caña integral en azucaritos Azucarera 300 g.,"1,72 €",0 g,380 Kcal,1615 KJ,0 g,95 g,0 g
Velita de salchichón ibérico de cebo 50% raza ibérica Valturra Ibéricos 200 g,"2,65 €",37.2 g,460 Kcal,1909 KJ,3.43 g,4.2 g,27.1 g
Rabas empanadas Extra Carrefour 400 g.,"2,79 €",1 g,89 Kcal,376 KJ,0.73 g,10 g,9.2 g
Bífidus desnatado con trozos de kiwi sin azúcar añadido Carrefour pack de 4 unidades de 125 g.,"1,30 €",1 g,79 Kcal,333 KJ,0 g,15 g,4 g
Bombón golden toffe Wonder Magnum 3 ud.,"4,69 €",19 g,315 Kcal,1319 KJ,0.19 g,31 g,4.4 g
Atún claro con aceite de oliva virgen extra Ligero Calvo pack de 3 unidades de 56 g.,"4,95 €",7 g,155 Kcal,650 KJ,1 g,0 g,23 g
Baguette precocida Carrefour Classic' pack de 2 unidades de 150 g.,"0,92 €",1.1 g,246.0 Kcal,1042.0 KJ,1.4 g,50.0 g,7.8 g
Crema de queso azul Carrefour sin gluten 125 g.,"1,71 €",24 g,276 Kcal,1141 KJ,2.3 g,1.9 g,13 g
Palitos de mar 450 g.,"1,75 €",3.9 g,116 Kcal,490 KJ,2.2 g,14 g,7.3 g
Patatas fritas Tyrrell's 150 g.,"3,95 €",22.6 g,447 Kcal,1871.5 KJ,1.5 g,55 g,4.9 g
Fabada con bocaditos Hi Vegs! sin gluten 300 g.,"4,79 €",3.1 g,114.0 Kcal,477.0 KJ,0.9 g,11.0 g,5.3 g
Garbanzos con su sofrito Hoy Legumbres Litoral sin gluten 440 g.,"2,05 €",2.5 g,90 Kcal,377 KJ,0.71 g,10.9 g,4.3 g
Tortillas de maíz Carrefour Sensation sin gluten 10 ud.,"2,59 €",2.2 g,226 Kcal,954 KJ,0.98 g,43 g,5.3 g
Yogur desnatado cremoso natural edulcorado sin azúcar añadido Danone Vitalinea pack de 4 unidades de 120 g.,"2,69 €",0.1 g,54 Kcal,229 KJ,0.21 g,6.9 g,5.1 g
Bizcocho Mármol con Chocolate Ecológico La Granja 300 g,"4,15 €",26.0 g,457.0 Kcal,1909.0 KJ,1.3 g,47.0 g,7.6 g
Snacks infantil de fresa y manzana ecológico Smileat 25 g.,"1,72 €",0.5 g,295 Kcal,1247 KJ,0.01 g,65 g,2.5 g
Coca Cola zero azúcar sabor cereza lata 33 cl.,"0,89 €",0 g,0.3 Kcal,1.0 KJ,0.02 g,0 g,0 g
Pasta Fusilli nº 98 Barilla 500 g.,"1,89 €",2 g,359 Kcal,1521 KJ,,71.2 g,12.5 g
Helado Maxbon Mini Classic Nestle 6 Ud.,"6,45 €",17 g,330 Kcal,1382 KJ,0.19 g,38 g,4.3 g
Corazón escarola maxi bol 250 g,"2,19 €",0.2 g,14 Kcal,59 KJ,0.06 g,0.3 g,1.3 g
Cereales con chocolate Corn Flakes Nestlé sin gluten 375 g,"4,09 €",3.7 g,394.0 Kcal,1666.0 KJ,0.98 g,81.8 g,6.1 g
Aperitivos de máiz sabor explosivo Puntazos Aspil sin gluten 110 g.,"1,25 €",17 g,451 Kcal,1893 KJ,2 g,66 g,5.8 g
Nachos triangulares Carrefour 375 g,"4,00 €",20 g,476 Kcal,1996 KJ,1.1 g,64 g,7.6 g
Carabinero crudo congelado Extra Carrefour 400 g.,"38,40 €",0.9 g,76 Kcal,322 KJ,0.88 g,0 g,17 g
Tomate frito gourmet estilo Kikí 350 g.,"8,09 €",20.5 g,221 Kcal,912 KJ,0.46 g,7.3 g,1.2 g
Fiambre de Pechuga de Pavo en lonchas El Pozo sin gluten 80 g,"1,00 €",1 g,81 Kcal,343 KJ,2.4 g,6 g,12 g
Leche fermentada desnatada con bifidus cremoso sabor mango Danone Activia pack de 4 unidades de 120 g.,"2,39 €",0.3 g,59.0 Kcal,249.0 KJ,0.13 g,8.6 g,4.5 g
Chocolate relleno de cheesecake Milka 300 g.,"3,69 €",30 g,531 Kcal,2219 KJ,0.36 g,60 g,4.9 g
Patatas fritas para horno ecológicas Carrefour Bio 600 g.,"3,59 €",5 g,145 Kcal,607 KJ,0 g,22 g,3 g
